C1: Principal | Créditos
A3: Projeto | Componentes | Cálculos | Protótipo | Arquivos | Simulações
A4: Apresentação dos Cálculos - Sistema Epicicloidal

A1: Demonstrativos
A2: Geral
A3: Engrenagem Helicoidal
A4: Eixo Entalhado
A5: Parafusos
A6: Tabelas
A7: Geral
A8: Engrenagem Helicoidal
A9: Engrenagem Cônica
A10: Engrenagem Curva
A11: Eixo Entalhado
A12: Epicicloidal
A13: Parafusos
A14: Eixos

A1: Sistema Epicicloidal do Diferencial
A2: NOME DAS ENGRENAGENS | D2: D.Curvos | E2: Coroa Dif.
A3: Dimensão | B3: Letra | C3: Unidade | D3: 1: Pinhão | E3: 2: Coroa
A4: Valores Medidos para Cálculo
A5: Número de Dentes | B5: Z | C5: - | D5: 10 | E5: 41
A6: Valores Adotados
A7: Rendimento de Rolamento | B7: ETA r | C7: % | D7: 99
A8: Rendimento do Par Engrenado | B8: ETA e | C8: % | D8: 98
A9: Diâmetro da Roda | B9: Dr | C9: mm | D9: 150
A10: Valores Calculados
A11: Relação de Transmissão | B11: i | C11: - | D11: =E5/D5 -> 4.1
A13: Sistema Epicicloidal com 1ª Marcha
A14: SAÍDA | D14: Roda Esquerda | E14: Roda Direita
A15: Valores Adicionais
A16: Potência de Entrada | B16: Pe | C16: W | D16: 94.128803999999988
A17: Rotação de Entrada | B17: ne | C17: RPM | D17: 92.903225806451601
A18: Valores Calculados
A19: Rotação de Arrastamento | B19: na | C19: RPM | D19: =D17/$D$11 -> 22.659323367427223
A20: Potência de Saída | B20: Ps | C20: W | D20: =D16*(D9/100)*(#REF!/100) -> #REF!
A21: Rotação de Saída | B21: ns | C21: RPM | D21: =D17/D11 -> 22.659323367427223
A22: Momento Torsor | B22: Mt | C22: N x mm | D22: =D16/(D19*0.001) -> 4154.0871487499999 | E22: =D16/(E19*0.001) -> #DIV/0!
A23: Rotação de Saída | B23: ns | C23: RPM | D23: 15.578284815106215 | E23: 15.578284815106215
A24: Velocidade Angular | B24: w | C24: rad/s | D24: =2*PI()*(D23/60) -> 1.6313541710222372 | E24: =2*PI()*(E23/60) -> 1.6313541710222372
A25: Potência de Saída | B25: Ps | C25: W | D25: =(D16*($D$7/100)*($D$8/100))/2 -> 45.661882820399988 | E25: =(D16*($D$7/100)*($D$8/100))/2 -> 45.661882820399988
A26: Momento Torsor | B26: Mt | C26: N x mm | D26: =D25/(D24*0.001) -> 27990.171375102069 | E26: =E25/(E24*0.001) -> 27990.171375102069
A27: Velocidade Linear do Protótipo | B27: v | C27: m/s² | D27: =PI()*($D$9/1000)*((D23+E23)/2) -> 7.3410937696000671
A29: Sistema Epicicloidal com 2ª Marcha
A30: SAÍDA | D30: Roda Esquerda | E30: Roda Direita
A31: Valores Adicionais
A32: Potência de Entrada | B32: Pe | C32: W | D32: 94.128803999999988
A33: Rotação de Entrada | B33: ne | C33: RPM | D33: 161.37096774193549
A34: Valores Calculados
A35: Rotação de Arrastamento | B35: na | C35: RPM | D35: =D33/$D$11 -> 39.358772619984272
A36: Rotação de Saída | B36: ns | C36: RPM | D36: 27.059156176239185 | E36: 27.059156176239185
A37: Velocidade Angular | B37: w | C37: rad/s | D37: =2*PI()*(D36/60) -> 2.8336282085203965 | E37: =2*PI()*(E36/60) -> 2.8336282085203965
A38: Potência de Saída | B38: Ps | C38: W | D38: =(D32*($D$7/100)*($D$8/100))/2 -> 45.661882820399988 | E38: =(D32*($D$7/100)*($D$8/100))/2 -> 45.661882820399988
A39: Momento Torsor | B39: Mt | C39: N x mm | D39: =D38/(D37*0.001) -> 16114.281571273154 | E39: =E38/(E37*0.001) -> 16114.281571273154
A40: Velocidade Linear do Protótipo | B40: v | C40: m/s² | D40: =PI()*($D$9/1000)*((D36+E36)/2) -> 12.751326938341785
A42: Sistema Epicicloidal com 3ª Marcha
A43: SAÍDA | D43: Roda Esquerda | E43: Roda Direita
A44: Valores Adicionais
A45: Potência de Entrada | B45: Pe | C45: W | D45: 94.128803999999988
A46: Rotação de Entrada | B46: ne | C46: RPM | D46: 252.58064516129031
A47: Valores Calculados
A48: Rotação de Arrastamento | B48: na | C48: RPM | D48: =D46/$D$11 -> 61.605035405192766
A49: Rotação de Saída | B49: ns | C49: RPM | D49: 42.353461841070022 | E49: 42.353461841070022
A50: Velocidade Angular | B50: w | C50: rad/s | D50: =2*PI()*(D49/60) -> 4.4352441524667068 | E50: =2*PI()*(E49/60) -> 4.4352441524667068
A51: Potência de Saída | B51: Ps | C51: W | D51: =(D45*($D$7/100)*($D$8/100))/2 -> 45.661882820399988 | E51: =(D45*($D$7/100)*($D$8/100))/2 -> 45.661882820399988
A52: Momento Torsor | B52: Mt | C52: N x mm | D52: =D51/(D50*0.001) -> 10295.235448313406 | E52: =E51/(E50*0.001) -> 10295.235448313406
A53: Velocidade Linear do Protótipo | B53: v | C53: m/s² | D53: =PI()*($D$9/1000)*((D49+E49)/2) -> 19.958598686100181
A55: Sistema Epicicloidal com 4ª Marcha
A56: SAÍDA | D56: Roda Esquerda | E56: Roda Direita
A57: Valores Adicionais
A58: Potência de Entrada | B58: Pe | C58: W | D58: 97.02
A59: Rotação de Entrada | B59: ne | C59: RPM | D59: 348
A60: Valores Calculados
A61: Rotação de Arrastamento | B61: na | C61: RPM | D61: =D59/$D$11 -> 84.878048780487816
A62: Rotação de Saída | B62: ns | C62: RPM | D62: 58.353658536585371 | E62: 58.353658536585371
A63: Velocidade Angular | B63: w | C63: rad/s | D63: =2*PI()*(D62/60) -> 6.1107808322874639 | E63: =2*PI()*(E62/60) -> 6.1107808322874639
A64: Potência de Saída | B64: Ps | C64: W | D64: =(D58*($D$7/100)*($D$8/100))/2 -> 47.064401999999994 | E64: =(D58*($D$7/100)*($D$8/100))/2 -> 47.064401999999994
A65: Momento Torsor | B65: Mt | C65: N x mm | D65: =D64/(D63*0.001) -> 7701.8638520508439 | E65: =E64/(E63*0.001) -> 7701.8638520508439
A66: Velocidade Linear do Protótipo | B66: v | C66: m/s² | D66: =PI()*($D$9/1000)*((D62+E62)/2) -> 27.498513745293589
A68: Sistema Epicicloidal com Marcha Ré
A69: SAÍDA | D69: Roda Esquerda | E69: Roda Direita
A70: Valores Adicionais
A71: Potência de Entrada | B71: Pe | C71: W | D71: 91.323765640799976
A72: Rotação de Entrada | B72: ne | C72: RPM | D72: 91.209677419354819
A73: Valores Calculados
A74: Rotação de Arrastamento | B74: na | C74: RPM | D74: =D72/$D$11 -> 22.246262785208494
A75: Rotação de Saída | B75: ns | C75: RPM | D75: 15.294305664830839 | E75: 15.294305664830839
A76: Velocidade Angular | B76: w | C76: rad/s | D76: =2*PI()*(D75/60) -> 1.6016159439463105 | E76: =2*PI()*(E75/60) -> 1.6016159439463105
A77: Potência de Saída | B77: Ps | C77: W | D77: =(D71*($D$7/100)*($D$8/100))/2 -> 44.30115871235207 | E77: =(D71*($D$7/100)*($D$8/100))/2 -> 44.30115871235207
A78: Momento Torsor | B78: Mt | C78: N x mm | D78: =D77/(D76*0.001) -> 27660.288273102466 | E78: =E77/(E76*0.001) -> 27660.288273102466
A79: Velocidade Linear do Protótipo | B79: v | C79: m/s² | D79: =PI()*($D$9/1000)*((D75+E75)/2) -> 7.2072717477583979

A1: © Projeto ECM 2000 - Proibida a reprodução. | D1: Voltar ao Início desta Página