C1: Principal | Créditos
A3: Projeto | Componentes | Cálculos | Protótipo | Arquivos | Simulações
A4: Apresentação dos Cálculos - Engrenagens Cônicas

A1: Demonstrativos
A2: Geral
A3: Engrenagem Helicoidal
A4: Eixo Entalhado
A5: Parafusos
A6: Tabelas
A7: Geral
A8: Engrenagem Helicoidal
A9: Engrenagem Cônica
A10: Engrenagem Curva
A11: Eixo Entalhado
A12: Epicicloidal
A13: Parafusos
A14: Eixos

A1: Engrenagens Cônicas do Diferencial
A2: NOME DAS ENGRENAGENS | D2: ECP | E2: ECG
A3: Dimensão | B3: Letra | C3: Unidade | D3: 1: Pinhão | E3: 2: Coroa
A4: Valores Medidos para Cálculo
A5: Número de Dentes | B5: Z | C5: - | D5: 11 | E5: 16
A6: Altura do Dente | B6: h | C6: mm | D6: 8,00 | E6: 8,80
A7: Ângulo entre eixos | B7: KSI | C7: º | D7: 90,00
A8: Comprimento dos Dentes | B8: b | C8: mm | D8: 9,5 | E8: 11
A9: Valores Estipulados
A10: Altura da Cabeça (addendum) | B10: ha | C10: mm | D10: 3,64 | E10: 4,00
A11: Módulo | B11: m | C11: mm | D11: 3,82
A12: Valores Adotados
A13: Módulo (Normalizado) | B13: m | C13: mm | D13: 3.75
A14: Coeficiente de Deslocamento | B14: x | C14: - | D14: =Geral!$D$13 -> 0 | E14: =Geral!$E$13 -> 0
A15: Ângulo de Pressão | B15: ALFA | C15: º | D15: 20
A16: Ângulo do Cone Primitivo | B16: DELTA | C16: º | D16: =D7/2 -> 45
A17: Valores Calculados
A18: Relação de Transmissão | B18: i | C18: - | D18: =E5/D5 -> 1.4545454545454546
A19: Relação de Transm.Equivalente | B19: iv | C19: - | D19: =(E5*COS(RADIANS($D$16)))/(D5*COS(RADIANS($D$16))) -> 1.4545454545454546
A20: Altura da Cabeça (addendum) | B20: ha | C20: mm | D20: =D13 -> 3.75
A21: Altura do Pé (dedendum) | B21: hf | C21: mm | D21: =1.2*D13 -> 4.5
A22: Diâmetro Primitivo | B22: d | C22: mm | D22: =D5*$D$13 -> 41.25 | E22: =E5*$D$13 -> 60
A23: Diâmetro da Cabeça | B23: da | C23: mm | D23: =D22+(2*$D$20*(COS(RADIANS($D$16)))) -> 46.553300858899107 | E23: =E22+(2*$D$20*(COS(RADIANS($D$16)))) -> 65.303300858899107
A24: Diâmetro do Pé | B24: df | C24: mm | D24: =D22-(2*$D$21*(COS(RADIANS($D$16)))) -> 34.886038969321071 | E24: =E22-(2*$D$21*(COS(RADIANS($D$16)))) -> 53.636038969321071
A25: Diâmetro Médio | B25: dm | C25: mm | D25: =2*($D$27-(0.5*D8))*(SIN(RADIANS($D$16))) -> 53.282485578727794 | E25: =2*($D$27-(0.5*E8))*(SIN(RADIANS($D$16))) -> 52.221825406947978
A26: Diâmetro Médio Equivalente | B26: dmv | C26: mm | D26: =D25/(COS(RADIANS($D$16))) -> 75.352813742385692 | E26: =E25/(COS(RADIANS($D$16))) -> 73.852813742385706
A27: Geratriz Primitiva | B27: OC | C27: mm | D27: =E22/(2*(SIN(RADIANS($D$16)))) -> 42.426406871192853
A28: Número Virtual de Dentes | B28: Zv | C28: - | D28: =D5/COS(RADIANS($D$16)) -> 15.556349186104045 | E28: =E5/COS(RADIANS($D$16)) -> 22.627416997969519
A29: Altura do Dente | B29: h | C29: mm | D29: =0.5*(D23-D24) -> 5.833630944789018 | E29: =0.5*(E23-E24) -> 5.833630944789018
A30: Módulo Médio | B30: mm | C30: mm | D30: =(1-(0.5*D8/$D$27))*D13 -> 3.3301553486704876
A31: Ângulo de Cabeça | B31: DA | C31: º | D31: =$D$16+ATAN(RADIANS($D$20/$D$27)) -> 45.001542666463102
A32: Ângulo do Pé | B32: DF | C32: º | D32: =$D$16-ATAN(RADIANS($D$21/$D$27)) -> 44.998148800890419

A1: © Projeto ECM 2000 - Proibida a reprodução. | D1: Voltar ao Início desta Página