C1: Principal | Créditos
A3: Projeto | Componentes | Cálculos | Protótipo | Arquivos | Simulações
A4: Apresentação dos Cálculos - Dimensionamento de Eixos

A1: Demonstrativos
A2: Geral
A3: Engrenagem Helicoidal
A4: Eixo Entalhado
A5: Parafusos
A6: Tabelas
A7: Geral
A8: Engrenagem Helicoidal
A9: Engrenagem Cônica
A10: Engrenagem Curva
A11: Eixo Entalhado
A12: Epicicloidal
A13: Parafusos
A14: Eixos

A1: Dimensionamento do Eixo de Entrada do Câmbio
A2: Dimensão | B2: Letra | C2: Unidade | D2: Valor
A3: Valores Calculados pelas Engrenagens
A4: Força Tangencial | B4: Ft | C4: N | D4: ='Engrenagens Helicoidais'!$D$71 -> 117.80219916783807
A5: Força Axial | B5: Fa | C5: N | D5: ='Engrenagens Helicoidais'!$D$72 -> 31.565004133632485
A6: Força Radial | B6: Fr | C6: N | D6: ='Engrenagens Helicoidais'!$D$73 -> 44.389012966882191
A7: Momento Torsor | B7: Mt | C7: N x mm | D7: ='Engrenagens Helicoidais'!$D$70 -> 2744.0507429637128
A8: Valores Adicionais
A9: Diâmetro do Eixo de Entrada | B9: D | C9: mm | D9: =Geral!$D$29 -> 35
A10: Distância 4ª com Rolamento | B10: L | C10: mm | D10: =Geral!$D$31 -> 12
A11: Valores Estipulados (de Tabela)
A12: Limite de Fadiga | B12: Sd | C12: MPa | D12: 300
A13: Fator de Fixação | B13: k | C13: - | D13: 1.1
A14: Fator de Acabamento Superficial | B14: X | C14: - | D14: 00.92
A15: Fator de Forma de Fixação | B15: BETA k | C15: - | D15: 2.6
A16: Fatos de Choque | B16: s | C16: - | D16: 2.5
A17: Valores Calculados
A18: Módulo de Resistência à Flexão | B18: w | C18: mm^3 | D18: =0.1*($D$9)^3 -> 4287.5
A19: Módulo de Resistência à Torção | B19: wt | C19: mm^3 | D19: =0.2*($D$9)^3 -> 8575
A20: Reação Vertical no Rolamento | B20: V | C20: N | D20: =D4 -> 117.80219916783807
A21: Reação Horizontal no Rolamento | B21: H | C21: N | D21: =D6 -> 44.389012966882191
A22: Momento | B22: M | C22: N x mm | D22: =SQRT((D6*D10)^2+(D4*D10)^2) -> 1510.6538102878619
A23: Flexão | B23: SIGMA r | C23: MPa | D23: =D22/D18 -> 0.35233908111670248
A24: Torção | B24: TAL t | C24: MPa | D24: =D7/D19 -> 0.32000591754678864
A25: Flexo-Torção | B25: SIGMA eq | C25: MPa | D25: =SQRT((D23)^2+3*(D24)^2) -> 0.65677560085393594
A26: Tensão Admissível | B26: S adm | C26: MPa | D26: =(D12*D13*D14)/(D15*D16) -> 46.707692307692312
A28: Dimensionamento do Eixo Principal do Câmbio com 1ª Marcha
A29: Dimensão | B29: Letra | C29: Unidade | D29: Valor
A30: Valores Calculados pelas Engrenagens
A31: Força Tangencial | B31: Ft | C31: N | D31: ='Engrenagens Helicoidais'!$E$151 -> 217.01135328496852
A32: Força Axial | B32: Fa | C32: N | D32: ='Engrenagens Helicoidais'!$E$152 -> 58.14801686109238
A33: Força Radial | B33: Fr | C33: N | D33: ='Engrenagens Helicoidais'!$E$153 -> 81.7719859474157
A34: Momento Torsor | B34: Mt | C34: N x mm | D34: ='Engrenagens Helicoidais'!$E$150 -> 9972.4497904592954
A35: Valores Adicionais
A36: Diâmetro do Eixo de Entrada | B36: D | C36: mm | D36: =Geral!$D$29 -> 35
A37: Distância 4ª com Rolamento | B37: L | C37: mm | D37: =Geral!$D$31 -> 12
A38: Valores Adicionais
A39: Diâmetro do Eixo Principal | B39: D | C39: mm | D39: =Geral!$D$30 -> 37
A40: Distância 1ª e 2ª com Rolamento | B40: L | C40: mm | D40: =Geral!$D$32 -> 58
A41: Valores Estipulados (de Tabela)
A42: Limite de Fadiga | B42: Sd | C42: MPa | D42: 300
A43: Fator de Fixação | B43: k | C43: - | D43: 00.7
A44: Fator de Acabamento Superficial | B44: X | C44: - | D44: 00.92
A45: Fator de Forma de Fixação | B45: BETA k | C45: - | D45: 1.4
A46: Fatos de Choque | B46: s | C46: - | D46: 2.5
A47: Valores Calculados
A48: Módulo de Resistência à Flexão | B48: w | C48: mm^3 | D48: =0.1*(D39)^3 -> 5065.3
A49: Módulo de Resistência à Torção | B49: wt | C49: mm^3 | D49: =0.2*(D39)^3 -> 10130.6
A50: Reação Vertical no Rolamento | B50: V | C50: N | D50: =D31 -> 217.01135328496852
A51: Reação Horizontal no Rolamento | B51: H | C51: N | D51: =D33 -> 81.7719859474157
A52: Momento | B52: M | C52: N x mm | D52: =SQRT((D33*D40)^2+(D31*D40)^2) -> 13450.572047766724
A53: Flexão | B53: SIGMA r | C53: MPa | D53: =D52/D48 -> 2.6554344358215158
A54: Torção | B54: TAL t | C54: MPa | D54: =D34/D49 -> 0.98438886052744112
A55: Flexo-Torção | B55: SIGMA eq | C55: MPa | D55: =SQRT((D53)^2+3*(D54)^2) -> 3.155692686105267
A56: Tensão Admissível | B56: S adm | C56: MPa | D56: =(D42*D43*D44)/(D45*D46) -> 55.2
A58: Dimensionamento do Eixo Principal do Câmbio com 2ª Marcha
A59: Dimensão | B59: Letra | C59: Unidade | D59: Valor
A60: Valores Calculados pelas Engrenagens
A61: Força Tangencial | B61: Ft | C61: N | D61: ='Engrenagens Helicoidais'!$E$231 -> 150.96441967649986
A62: Força Axial | B62: Fa | C62: N | D62: ='Engrenagens Helicoidais'!$E$232 -> 40.450794338151226
A63: Força Radial | B63: Fr | C63: N | D63: ='Engrenagens Helicoidais'!$E$233 -> 56.884859789506578
A64: Momento Torsor | B64: Mt | C64: N x mm | D64: ='Engrenagens Helicoidais'!$E$230 -> 5741.2604490800159
A65: Valores Adicionais
A66: Diâmetro do Eixo Principal | B66: D | C66: mm | D66: =Geral!$D$30 -> 37
A67: Distância 1ª e 2ª com Rolamento | B67: L | C67: mm | D67: =Geral!$D$32 -> 58
A68: Valores Estipulados (de Tabela)
A69: Limite de Fadiga | B69: Sd | C69: MPa | D69: 300
A70: Fator de Fixação | B70: k | C70: - | D70: 00.7
A71: Fator de Acabamento Superficial | B71: X | C71: - | D71: 00.92
A72: Fator de Forma de Fixação | B72: BETA k | C72: - | D72: 1.4
A73: Fatos de Choque | B73: s | C73: - | D73: 2.5
A74: Valores Calculados
A75: Módulo de Resistência à Flexão | B75: w | C75: mm^3 | D75: =0.1*(D66)^3 -> 5065.3
A76: Módulo de Resistência à Torção | B76: wt | C76: mm^3 | D76: =0.2*(D66)^3 -> 10130.6
A77: Reação Vertical no Rolamento | B77: V | C77: N | D77: =D61 -> 150.96441967649986
A78: Reação Horizontal no Rolamento | B78: H | C78: N | D78: =D63 -> 56.884859789506578
A79: Momento | B79: M | C79: N x mm | D79: =SQRT((D63*D67)^2+(D61*D67)^2) -> 9356.9196854029396
A80: Flexão | B80: SIGMA r | C80: MPa | D80: =D79/D75 -> 1.8472587379627938
A81: Torção | B81: TAL t | C81: MPa | D81: =D64/D76 -> 0.56672462135312973
A82: Flexo-Torção | B82: SIGMA eq | C82: MPa | D82: =SQRT((D80)^2+3*(D81)^2) -> 2.0918640573238592
A83: Tensão Admissível | B83: S adm | C83: MPa | D83: =(D69*D70*D71)/(D72*D73) -> 55.2
A85: Dimensionamento do Eixo Principal do Câmbio com 3ª Marcha
A86: Dimensão | B86: Letra | C86: Unidade | D86: Valor
A87: Valores Calculados pelas Engrenagens
A88: Força Tangencial | B88: Ft | C88: N | D88: ='Engrenagens Helicoidais'!$E$311 -> 128.59932046516653
A89: Força Axial | B89: Fa | C89: N | D89: ='Engrenagens Helicoidais'!$E$312 -> 34.458084065832523
A90: Força Radial | B90: Fr | C90: N | D90: ='Engrenagens Helicoidais'!$E$313 -> 48.457473154024115
A91: Momento Torsor | B91: Mt | C91: N x mm | D91: ='Engrenagens Helicoidais'!$E$310 -> 3668.0275091344538
A92: Valores Adicionais
A93: Diâmetro do Eixo Principal | B93: D | C93: mm | D93: =Geral!$D$30 -> 37
A94: Distância 1ª e 2ª com Rolamento | B94: L | C94: mm | D94: =Geral!$D$33 -> 152
A95: Valores Estipulados (de Tabela)
A96: Limite de Fadiga | B96: Sd | C96: MPa | D96: 300
A97: Fator de Fixação | B97: k | C97: - | D97: 00.7
A98: Fator de Acabamento Superficial | B98: X | C98: - | D98: 00.92
A99: Fator de Forma de Fixação | B99: BETA k | C99: - | D99: 1.4
A100: Fatos de Choque | B100: s | C100: - | D100: 2.5
A101: Valores Calculados
A102: Módulo de Resistência à Flexão | B102: w | C102: mm^3 | D102: =0.1*(D93)^3 -> 5065.3
A103: Módulo de Resistência à Torção | B103: wt | C103: mm^3 | D103: =0.2*(D93)^3 -> 10130.6
A104: Reação Vertical no Rolamento | B104: V | C104: N | D104: =D88 -> 128.59932046516653
A105: Reação Horizontal no Rolamento | B105: H | C105: N | D105: =D90 -> 48.457473154024115
A106: Momento | B106: M | C106: N x mm | D106: =SQRT((D90*D94)^2+(D88*D94)^2) -> 20888.755568434655
A107: Flexão | B107: SIGMA r | C107: MPa | D107: =D106/D102 -> 4.1238930701902463
A108: Torção | B108: TAL t | C108: MPa | D108: =D91/D103 -> 0.36207406364227723
A109: Flexo-Torção | B109: SIGMA eq | C109: MPa | D109: =SQRT((D107)^2+3*(D108)^2) -> 4.1713051838783537
A110: Tensão Admissível | B110: S adm | C110: MPa | D110: =(D96*D97*D98)/(D99*D100) -> 55.2

A1: © Projeto ECM 2000 - Proibida a reprodução. | D1: Voltar ao Início desta Página