C1: Principal | Créditos
A3: Projeto | Componentes | Cálculos | Protótipo | Arquivos | Simulações
A4: Apresentação dos Cálculos - Engrenagens Curvas

A1: Demonstrativos
A2: Geral
A3: Engrenagem Helicoidal
A4: Eixo Entalhado
A5: Parafusos
A6: Tabelas
A7: Geral
A8: Engrenagem Helicoidal
A9: Engrenagem Cônica
A10: Engrenagem Curva
A11: Eixo Entalhado
A12: Epicicloidal
A13: Parafusos
A14: Eixos

A1: Entrada do Diferencial com 1ª Marcha
A2: NOME DAS ENGRENAGENS | D2: D.Curvos | E2: Coroa Dif.
A3: Dimensão | B3: Letra | C3: Unidade | D3: 1: Pinhão | E3: 2: Coroa
A4: Valores Medidos para Cálculo
A5: Número de Dentes | B5: Z | C5: - | D5: =Geral!$D$22 -> 10 | E5: =Geral!$E$22 -> 41
A6: Valores Adotados
A7: Rendimento de Rolamento | B7: ETA r | C7: % | D7: =Geral!$D$3 -> 99
A8: Rendimento do Par Engrenado | B8: ETA e | C8: % | D8: =Geral!$D$4 -> 98
A9: Valores Adicionais
A10: Potência de Entrada | B10: Pe | C10: W | D10: ='Engrenagens Helicoidais'!$D$148 -> 94.128803999999988
A11: Rotação de Entrada | B11: ne | C11: RPM | D11: ='Engrenagens Helicoidais'!$D$149 -> 92.903225806451601
A12: Valores Calculados
A13: Relação de Transmissão | B13: i | C13: - | D13: =E5/D5 -> 4.1
A14: Velocidade Angular | B14: w | C14: rad / s | D14: =2*PI()*(D11/60) -> 9.7288030562780676 | E14: =2*PI()*((D11/60)/D13) -> 2.3728787942141629
A15: Potência de Saída | B15: Ps | C15: W | D15: =D10*(D7/100)*(D8/100) -> 91.323765640799976
A16: Rotação de Saída | B16: ns | C16: RPM | D16: =D11/D13 -> 22.659323367427223
A17: Momento Torsor | B17: Mt | C17: N x mm | D17: =D10/(D14*0.001) -> 9675.2707867036097 | E17: =D10/(E14*0.001) -> 39668.610225484801
A22: Entrada do Diferencial com 2ª Marcha
A23: NOME DAS ENGRENAGENS | D23: D.Curvos | E23: Coroa Dif.
A24: Dimensão | B24: Letra | C24: Unidade | D24: 1: Pinhão | E24: 2: Coroa
A25: Valores Medidos para Cálculo
A26: Número de Dentes | B26: Z | C26: - | D26: =Geral!$D$22 -> 10 | E26: =Geral!$E$22 -> 41
A27: Valores Adotados
A28: Rendimento de Rolamento | B28: ETA r | C28: % | D28: =Geral!$D$3 -> 99
A29: Rendimento do Par Engrenado | B29: ETA e | C29: % | D29: =Geral!$D$4 -> 98
A30: Valores Adicionais
A31: Potência de Entrada | B31: Pe | C31: W | D31: ='Engrenagens Helicoidais'!$D$228 -> 94.128803999999988
A32: Rotação de Entrada | B32: ne | C32: RPM | D32: ='Engrenagens Helicoidais'!$D$229 -> 161.37096774193549
A33: Valores Calculados
A34: Relação de Transmissão | B34: i | C34: - | D34: =E26/D26 -> 4.1
A35: Velocidade Angular | B35: w | C35: rad / s | D35: =2*PI()*(D32/60) -> 16.898728225357999 | E35: =2*PI()*((D32/60)/D34) -> 4.1216410305751223
A36: Potência de Saída | B36: Ps | C36: W | D36: =D31*(D28/100)*(D29/100) -> 91.323765640799976
A37: Rotação de Saída | B37: ns | C37: RPM | D37: =D32/D34 -> 39.358772619984272
A38: Momento Torsor | B38: Mt | C38: N x mm | D38: =D31/(D35*0.001) -> 5570.1708876974308 | E38: =D31/(E35*0.001) -> 22837.700639559458
A40: Entrada do Diferencial com 3ª Marcha
A41: NOME DAS ENGRENAGENS | D41: D.Curvos | E41: Coroa Dif.
A42: Dimensão | B42: Letra | C42: Unidade | D42: 1: Pinhão | E42: 2: Coroa
A43: Valores Medidos para Cálculo
A44: Número de Dentes | B44: Z | C44: - | D44: =Geral!$D$22 -> 10 | E44: =Geral!$E$22 -> 41
A45: Valores Adotados
A46: Rendimento de Rolamento | B46: ETA r | C46: % | D46: =Geral!$D$3 -> 99
A47: Rendimento do Par Engrenado | B47: ETA e | C47: % | D47: =Geral!$D$4 -> 98
A48: Valores Adicionais
A49: Potência de Entrada | B49: Pe | C49: W | D49: ='Engrenagens Helicoidais'!$D$308 -> 94.128803999999988
A50: Rotação de Entrada | B50: ne | C50: RPM | D50: ='Engrenagens Helicoidais'!$D$309 -> 252.58064516129031
A51: Valores Calculados
A52: Relação de Transmissão | B52: i | C52: - | D52: =E44/D44 -> 4.1
A53: Velocidade Angular | B53: w | C53: rad / s | D53: =2*PI()*(D50/60) -> 26.450183309255998 | E53: =2*PI()*((D50/60)/D52) -> 6.4512642217697556
A54: Potência de Saída | B54: Ps | C54: W | D54: =D49*(D46/100)*(D47/100) -> 91.323765640799976
A55: Rotação de Saída | B55: ns | C55: RPM | D55: =D50/D52 -> 61.605035405192766
A56: Momento Torsor | B56: Mt | C56: N x mm | D56: =D49/(D53*0.001) -> 3558.7202893622471 | E56: =D49/(E53*0.001) -> 14590.753186385215
A58: Entrada do Diferencial com 4ª Marcha
A59: NOME DAS ENGRENAGENS | D59: D.Curvos | E59: Coroa Dif.
A60: Dimensão | B60: Letra | C60: Unidade | D60: 1: Pinhão | E60: 2: Coroa
A61: Valores Medidos para Cálculo
A62: Número de Dentes | B62: Z | C62: - | D62: =Geral!$D$22 -> 10 | E62: =Geral!$E$22 -> 41
A63: Valores Adotados
A64: Rendimento de Rolamento | B64: ETA r | C64: % | D64: =Geral!$D$3 -> 99
A65: Rendimento do Par Engrenado | B65: ETA e | C65: % | D65: =Geral!$D$4 -> 98
A66: Valores Adicionais
A67: Potência de Entrada | B67: Pe | C67: W | D67: ='Engrenagens Helicoidais'!$D$334 -> 97.02
A68: Rotação de Entrada | B68: ne | C68: RPM | D68: ='Engrenagens Helicoidais'!$D$335 -> 348
A69: Valores Calculados
A70: Relação de Transmissão | B70: i | C70: - | D70: =E62/D62 -> 4.1
A71: Velocidade Angular | B71: w | C71: rad / s | D71: =2*PI()*(D68/60) -> 36.4424747816416 | E71: =2*PI()*((D68/60)/D70) -> 8.8884084833272201
A72: Potência de Saída | B72: Ps | C72: W | D72: =D67*(D64/100)*(D65/100) -> 94.128803999999988
A73: Rotação de Saída | B73: ns | C73: RPM | D73: =D68/D70 -> 84.878048780487816
A74: Momento Torsor | B74: Mt | C74: N x mm | D74: =D67/(D71*0.001) -> 2662.2780308233941 | E74: =D67/(E71*0.001) -> 10915.339926375915
A76: Entrada do Diferencial com Marcha Ré
A77: NOME DAS ENGRENAGENS | D77: D.Curvos | E77: Coroa Dif.
A78: Dimensão | B78: Letra | C78: Unidade | D78: 1: Pinhão | E78: 2: Coroa
A79: Valores Medidos para Cálculo
A80: Número de Dentes | B80: Z | C80: - | D80: =Geral!$D$22 -> 10 | E80: =Geral!$E$22 -> 41
A81: Valores Adotados
A82: Rendimento de Rolamento | B82: ETA r | C82: % | D82: =Geral!$D$3 -> 99
A83: Rendimento do Par Engrenado | B83: ETA e | C83: % | D83: =Geral!$D$4 -> 98
A84: Valores Adicionais
A85: Potência de Entrada | B85: Pe | C85: W | D85: ='Engrenagens Helicoidais'!$D$486 -> 91.323765640799976
A86: Rotação de Entrada | B86: ne | C86: RPM | D86: ='Engrenagens Helicoidais'!$D$487 -> 91.209677419354819
A87: Valores Calculados
A88: Relação de Transmissão | B88: i | C88: - | D88: =E80/D80 -> 4.1
A89: Velocidade Angular | B89: w | C89: rad / s | D89: =2*PI()*(D86/60) -> 9.5514550838979986 | E89: =2*PI()*((D86/60)/D88) -> 2.3296231911946341
A90: Potência de Saída | B90: Ps | C90: W | D90: =D85*(D82/100)*(D83/100) -> 88.60231742470414
A91: Rotação de Saída | B91: ns | C91: RPM | D91: =D86/D88 -> 22.246262785208494
A92: Momento Torsor | B92: Mt | C92: N x mm | D92: =D85/(D89*0.001) -> 9561.241176201007 | E92: =D85/(E89*0.001) -> 39201.088822424121

A1: © Projeto ECM 2000 - Proibida a reprodução. | D1: Voltar ao Início desta Página