C1: Principal | Créditos
A3: Projeto | Componentes | Cálculos | Protótipo | Arquivos | Simulações
A4: Apresentação dos Cálculos - Parafusos de Fixação

A1: Demonstrativos
A2: Geral
A3: Engrenagem Helicoidal
A4: Eixo Entalhado
A5: Parafusos
A6: Tabelas
A7: Geral
A8: Engrenagem Helicoidal
A9: Engrenagem Cônica
A10: Engrenagem Curva
A11: Eixo Entalhado
A12: Epicicloidal
A13: Parafusos
A14: Eixos

A1: Parafusos de Fixação - Coroa com Caixa-Satélites do Diferencial
A2: Dimensão | B2: Letra | C2: Unidade | D2: Valor
A3: Valores Medidos para Cálculo
A4: Diâmetro Nominal | B4: d | C4: mm | D4: 8,00
A5: Número de Parafusos | B5: Z | C5: - | D5: 9
A6: Distância P.Genérico ao Centróide | B6: ri | C6: mm | D6: 70
A7: Valores Estipulados (de Tabela)
A8: Força de Ensaio | B8: Fensaio | C8: N | D8: =Geral!$D$25 -> 30400
A9: Valores Adotados
A10: Coeficiente de Segurança | B10: n | C10: - | D10: =Geral!$D$26 -> 1.1
A11: Classe de Resistência | B11: - | C11: - | D11: 10.9
A12: Ângulo de Atrito entre Filetes | B12: sigma | C12: º | D12: 9.6
A13: Coeficiente de Atrito entre Chapas | B13: mi | C13: - | D13: 00.17
A14: Valores Calculados
A15: Força de Aperto | B15: Fap | C15: N | D15: =0.75*D8 -> 22800
A16: Momento de Aperto | B16: Map | C16: N*mm | D16: =D15*0.2*D4 -> 36480
A17: Resultante por Parafuso | B17: R | C17: N | D17: =D15*D13 -> 3876
A18: Constante Elástica do Parafuso | B18: K | C18: N/mm | D18: =D17/D6 -> 55.371428571428581
A19: Momento Externo Máximo | B19: Mmax | C19: N*mm | D19: =D18*(D5*(D6^2)) -> 2441880

A1: © Projeto ECM 2000 - Proibida a reprodução. | D1: Voltar ao Início desta Página