C1: Principal | Créditos
A3: Projeto | Componentes | Cálculos | Protótipo | Arquivos | Simulações
A4: Apresentação dos Cálculos - Engrenagens Helicoidais

A1: Demonstrativos
A2: Geral
A3: Engrenagem Helicoidal
A4: Eixo Entalhado
A5: Parafusos
A6: Tabelas
A7: Geral
A8: Engrenagem Helicoidal
A9: Engrenagem Cônica
A10: Engrenagem Curva
A11: Eixo Entalhado
A12: Epicicloidal
A13: Parafusos
A14: Eixos

A1: Câmbio - Entrada 1ª, 2ª, 3ª, Ré
A2: NOME DAS ENGRENAGENS | D2: 4ª | E2: 4ª Primário
A3: Dimensão | B3: Letra | C3: Unidade | D3: 1: Pinhão | E3: 2: Coroa
A4: Valores Medidos para Cálculo
A5: Número de Dentes | B5: Z | C5: - | D5: 15 | E5: 31
A6: Passo Transversal | B6: pt | C6: mm | D6: 10 | E6: 9.1
A7: Largura do Dente | B7: b | C7: mm | D7: 20.6 | E7: 20
A8: Valores Medidos para Conferência
A9: Espessura da Cabeça | B9: Sa | C9: mm | D9: 1.1 | E9: 2.6
A10: Espessura do Pé | B10: Sf | C10: mm | D10: 6.5 | E10: 6.5
A11: Altura do Dente | B11: h | C11: mm | D11: 6.3 | E11: 6
A12: Diâmetro da Cabeça | B12: da | C12: mm | D12: 52.25 | E12: 98
A13: Diâmetro do Pé | B13: df | C13: mm | D13: 39.8 | E13: 85.4
A14: Largura Transversal do Dente | B14: bt | C14: mm | D14: 22 | E14: 20.9
A15: Valores Estipulados
A16: Ângulo de Pressão | B16: ALFA | C16: º | D16: =DEGREES(ATAN(((D10/2)-(D9/2))/D11)) -> 23.198590513648188 | E16: =DEGREES(ATAN(((E10/2)-(E9/2))/E11)) -> 18.004161605913382
A17: Ângulo de Hélice | B17: BETA | C17: º | D17: =DEGREES(ATAN((D6/2)/D7)) -> 13.642914775990068 | E17: =DEGREES(ATAN((E6/2)/E7)) -> 12.816647648997435
A18: Módulo Transversal | B18: mt | C18: mm | D18: =D6/PI() -> 3.183098861837907 | E18: =E6/PI() -> 2.896619964272495
A19: Módulo Normal | B19: mn | C19: mm | D19: =D18*(COS(RADIANS(D22))) -> 3.074637398280573 | E19: =E18*(COS(RADIANS(D22))) -> 2.7979200324353215
A20: Valores Adotados
A21: Ângulo de Pressão | B21: ALFA | C21: º | D21: 20
A22: Ângulo de Hélice | B22: BETA | C22: º | D22: 15
A23: Módulo (Normalizado) | B23: m | C23: mm | D23: 3
A24: Coeficiente de Deslocamento | B24: x | C24: - | D24: =Geral!$D$13 -> 0 | E24: =Geral!$E$13 -> 0
A25: Rendimento de Rolamento | B25: ETA r | C25: % | D25: =Geral!$D$3 -> 99
A26: Rendimento do Par Engrenado | B26: ETA e | C26: % | D26: =Geral!$D$4 -> 98
A27: Coeficiente de Segurança | B27: Kf | C27: - | D27: =Geral!$D$5 -> 1.5
A28: Valores Adicionais
A29: Potência de Entrada | B29: Pe | C29: W | D29: =Geral!$D$9 -> 100
A30: Rotação de Entrada | B30: ne | C30: RPM | D30: =Geral!$D$10 -> 348
A31: Fator de Forma do Dente | B31: Yf | C31: - | D31: =Geral!$D$14 -> 3.25 | E31: =Geral!$E$14 -> 2.75
A32: Fator de Serviço | B32: Ys | C32: - | D32: =Geral!$D$15 -> 1.25
A33: Precisão do Dente | B33: a* | C33: - | D33: =Geral!$D$16 -> 6
A34: Módulo de Elasticidade Equivalente | B34: Ec | C34: MPa | D34: =Geral!$D$6 -> 210000
A35: Valores Calculados
A36: Relação de Transmissão | B36: i | C36: - | D36: =IF((E5/D5),(E5/D5),(E12/D12)) -> 2.0666666666666669
A37: Módulo Normal | B37: mn | C37: mm | D37: =D23 -> 3
A38: Módulo Transversal | B38: mt | C38: mm | D38: =D37/(COS(RADIANS(D22))) -> 3.1058285412302489
A39: Diâmetro Primitivo | B39: d | C39: mm | D39: =D5*D38 -> 46.58742811845373 | E39: =E5*D38 -> 96.280684778137712
A40: Distância entre eixos | B40: a | C40: mm | D40: =(D39+E39)/2 -> 71.434056448295721
A41: Número Virtual de Dentes | B41: Zv | C41: - | D41: =D5/(COS(RADIANS(D22)))^3 -> 16.644084989043542 | E41: =E5/(COS(RADIANS(D22)))^3 -> 34.397775644023319
A42: Ângulo de Pressão Normal | B42: ALFA n | C42: º | D42: =D21 -> 20
A43: Ângulo de Pressão Aparente | B43: ALFA t | C43: º | D43: =DEGREES(ATAN((TAN(RADIANS(D42))/COS(RADIANS(D22))))) -> 20.646896487046469
A44: Ângulo P.Normal na Cabeça | B44: ALFA a | C44: º | D44: =DEGREES(ACOS(D55/D57)) -> 34.003464793683179 | E44: =DEGREES(ACOS(E55/E57)) -> 28.251671184218914
A45: Ângulo de Hélice na Base | B45: BETA b | C45: º | D45: =DEGREES(ASIN((SIN(RADIANS(D22))*(COS(RADIANS(D42)))))) -> 14.076095421662487
A46: Evolvente de ALFA a | B46: ev ALFA a | C46: - | D46: =TAN(RADIANS(D44))-RADIANS(D44) -> 8.1124087225939889E-2 | E46: =TAN(RADIANS(E44))-RADIANS(E44) -> 4.4272290099068967E-2
A47: Evolvente de ALFA t | B47: ev ALFA t | C47: - | D47: =TAN(RADIANS(D43))-RADIANS(D43) -> 1.6453389896665449E-2
A48: Passo Axial | B48: px | C48: mm | D48: =PI()*D37/(SIN(RADIANS(D22))) -> 36.414545757388652
A49: Passo Normal | B49: pn | C49: mm | D49: =PI()*D37 -> 9.4247779607693793
A50: Passo Normal de Base | B50: pbn | C50: mm | D50: =PI()*D37*(COS(RADIANS(D42))) -> 8.8563943022806484
A51: Passo Frontal de Base | B51: pbt | C51: mm | D51: =PI()*D38*(COS(RADIANS(D42))) -> 9.1688140654707304
A52: Grau de Recobrimento Transversal | B52: E ALFA | C52: - | D52: =(1/(2*PI()))*((D5*(TAN(RADIANS(D44))-TAN(RADIANS(D43))))+(E5*(TAN(RADIANS(E44))-TAN(RADIANS(D43))))) -> 1.503022175500059
A53: Grau de Recobrimento Normal | B53: E BETA | C53: - | D53: =(D7*SIN(RADIANS(D22)))/(PI()*D37) -> 0.56570800408296129
A54: Grau de Recobrimento Total | B54: E | C54: - | D54: =D52+D53 -> 2.0687301795830204
A55: Diâmetro da Base | B55: db | C55: mm | D55: =D39*COS(RADIANS(D43)) -> 43.595175401953753 | E55: =E39*COS(RADIANS(D43)) -> 90.096695830704434
A56: Diâmetro do Pé | B56: df | C56: mm | D56: =D39-(2*D37*(1+0.25-D24)) -> 39.08742811845373 | E56: =E39-(2*D37*(1+0.25-E24)) -> 88.780684778137712
A57: Diâmetro da Cabeça | B57: da | C57: mm | D57: =(2*D40)-E56-(2*0.25*D37) -> 52.58742811845373 | E57: =(2*D40)-D56-(2*0.25*D37) -> 102.28068477813771
A58: Espessura Normal | B58: Sn | C58: mm | D58: =D37*((PI()/2)+(2*D24*TAN(RADIANS(D42)))) -> 4.7123889803846897 | E58: =D37*((PI()/2)+(2*E24*TAN(RADIANS(D42)))) -> 4.7123889803846897
A59: Espessura Transversal | B59: St | C59: mm | D59: =D38*((PI()/2)+(2*D24*TAN(RADIANS(D42)))) -> 4.8786240642192267 | E59: =D38*((PI()/2)+(2*E24*TAN(RADIANS(D42)))) -> 4.8786240642192267
A60: Espessura Normal na Base | B60: Sbn | C60: mm | D60: =((D58/(D37*D5))+D47)*D37*D5*COS(RADIANS(D42)) -> 5.1239479594167712 | E60: =((E58/(D37*E5))+D47)*D37*E5*COS(RADIANS(D42)) -> 5.8660821549116475
A61: Espessura Transversal no Topo | B61: Sat | C61: mm | D61: =D57*((D58/(D39*COS(RADIANS(D22))))+D47-D46) -> 2.1060769477636891 | E61: =E57*((E58/(E39*COS(RADIANS(D22))))+D47-E46) -> 2.3373129972514115
A62: Altura do Dente | B62: h | C62: mm | D62: =0.5*(D57-D56) -> 6.75 | E62: =0.5*(E57-E56) -> 6.75
A63: Altura Útil Comum | B63: h' | C63: mm | D63: =(0.5*(D57+E57))-D40 -> 6
A64: Altura da Cabeça (addendum) | B64: há | C64: mm | D64: =(D57-D39)/2 -> 3 | E64: =(E57-E39)/2 -> 3
A65: Altura do Pé (dedendum) | B65: hf | C65: mm | D65: =(D39-D56)/2 -> 3.75 | E65: =(E39-E56)/2 -> 3.75
A66: Velocidade Angular | B66: w | C66: rad / s | D66: =2*PI()*(D30/60) -> 36.4424747816416 | E66: =2*PI()*((D30/60)/D36) -> 17.633455539503998
A67: Velocidade Tangencial | B67: v | C67: m / s^2 | D67: =PI()*D39*(D30/60000) -> 0.84888058717414538
A68: Potência de Saída | B68: Ps | C68: W | D68: =D29*(D25/100)*(D26/100) -> 97.02
A69: Rotação de Saída | B69: ns | C69: RPM | D69: =D30/D36 -> 168.38709677419354
A70: Momento Torsor | B70: Mt | C70: N x mm | D70: =D29/(D66*0.001) -> 2744.0507429637128 | E70: =D29/(E66*0.001) -> 5671.0382021250061
A71: Força Tangencial | B71: Ft | C71: N | D71: =D29/D67 -> 117.80219916783807 | E71: =D71*(D26/100) -> 115.4461551844813
A72: Força Axial | B72: Fa | C72: N | D72: =D71*TAN(RADIANS(D22)) -> 31.565004133632485 | E72: =D72*(D26/100) -> 30.933704050959836
A73: Força Radial | B73: Fr | C73: N | D73: =(D71*TAN(RADIANS(D42))/COS(RADIANS(D22))) -> 44.389012966882191 | E73: =D73*(D26/100) -> 43.501232707544546
A74: Fator de Engrenamento | B74: YE | C74: - | D74: =0.25+(0.75/D52) -> 0.74899463376212205
A75: Fator de Carga | B75: YV | C75: - | D75: =(D33+SQRT(D67))/D33 -> 1.1535578598131433
A76: Fator de Ângulo de Hélice | B76: YBETA | C76: - | D76: =1-(D22/120) -> 0.875
A77: Fator YBETA-H | B77: YBETA-H | C77: - | D77: =IF(D53>1,0.8,1) -> 1
A78: Flexão no Pé do Dente | B78: Fadm | C78: MPa | D78: =((D71/(D7*D37))*D31*D74*D32*D75*D76)*D27 -> 8.7816413838396894 | E78: =((E71/(E7*D37))*E31*D74*D32*D75*D76)*D27 -> 7.5004674570250458
A79: Desgaste no Flanco do Dente | B79: Hadm | C79: MPa | D79: =SQRT(((0.7*D34*D71*(COS(RADIANS(D22))^2)*(1+(1/D36)))/(D7*D39*SIN(RADIANS(2*D43))))*D32*D75*D77) -> 233.63515777987035 | E79: =SQRT(((0.7*D34*E71*(COS(RADIANS(D22))^2)*(1+(1/D36)))/(E7*E39*SIN(RADIANS(2*D43))))*D32*D75*D77) -> 163.28061574523542
A81: Câmbio - 1ª Marcha
A82: NOME DAS ENGRENAGENS | D82: 1ª Primário | E82: 1ª
A83: Dimensão | B83: Letra | C83: Unidade | D83: 1: Pinhão | E83: 2: Coroa
A84: Valores Medidos para Cálculo
A85: Número de Dentes | B85: Z | C85: - | D85: 16 | E85: 29
A86: Passo Transversal | B86: pt | C86: mm | D86: 10 | E86: 9.1
A87: Largura do Dente | B87: b | C87: mm | D87: 19.6 | E87: 15.65
A88: Valores Medidos para Conferência
A89: Espessura da Cabeça | B89: Sa | C89: mm | D89: 1.1 | E89: 1.65
A90: Espessura do Pé | B90: Sf | C90: mm | D90: 6.6 | E90: 6
A91: Altura do Dente | B91: h | C91: mm | D91: 6.8 | E91: 6.85
A92: Diâmetro da Cabeça | B92: da | C92: mm | D92: 52 | E92: 95.2
A93: Diâmetro do Pé | B93: df | C93: mm | D93: 43 | E93: 80.05
A94: Largura Transversal do Dente | B94: bt | C94: mm | D94: 20.15 | E94: 17.6
A95: Valores Estipulados
A96: Ângulo de Pressão | B96: ALFA | C96: º | D96: =DEGREES(ATAN(((D90/2)-(D89/2))/D91)) -> 22.018987350019373 | E96: =DEGREES(ATAN(((E90/2)-(E89/2))/E91)) -> 17.615593092869112
A97: Ângulo de Hélice | B97: BETA | C97: º | D97: =DEGREES(ATAN((D86/2)/D87)) -> 14.311041262606411 | E97: =DEGREES(ATAN((E86/2)/E87)) -> 16.210987582536532
A98: Módulo Transversal | B98: mt | C98: mm | D98: =D86/PI() -> 3.183098861837907 | E98: =E86/PI() -> 2.896619964272495
A99: Módulo Normal | B99: mn | C99: mm | D99: =D98*(COS(RADIANS(D102))) -> 3.074637398280573 | E99: =E98*(COS(RADIANS(D102))) -> 2.7979200324353215
A100: Valores Adotados
A101: Ângulo de Pressão | B101: ALFA | C101: º | D101: 20
A102: Ângulo de Hélice | B102: BETA | C102: º | D102: 15
A103: Módulo (Normalizado) | B103: m | C103: mm | D103: 3
A104: Coeficiente de Deslocamento | B104: x | C104: - | D104: =Geral!$D$13 -> 0 | E104: =Geral!$E$13 -> 0
A105: Rendimento de Rolamento | B105: ETA r | C105: % | D105: =Geral!$D$3 -> 99
A106: Rendimento do Par Engrenado | B106: ETA e | C106: % | D106: =Geral!$D$4 -> 98
A107: Coeficiente de Segurança | B107: Kf | C107: - | D107: =Geral!$D$5 -> 1.5
A108: Valores Adicionais
A109: Potência de Entrada | B109: Pe | C109: W | D109: =$D$68 -> 97.02
A110: Rotação de Entrada | B110: ne | C110: RPM | D110: =$D$69 -> 168.38709677419354
A111: Fator de Forma do Dente | B111: Yf | C111: - | D111: =Geral!$D$14 -> 3.25 | E111: =Geral!$E$14 -> 2.75
A112: Fator de Serviço | B112: Ys | C112: - | D112: =Geral!$D$15 -> 1.25
A113: Precisão do Dente | B113: a* | C113: - | D113: =Geral!$D$16 -> 6
A114: Módulo de Elasticidade Equivalente | B114: Ec | C114: MPa | D114: =Geral!$D$6 -> 210000
A115: Valores Calculados
A116: Relação de Transmissão | B116: i | C116: - | D116: =IF((E85/D85),(E85/D85),(E92/D92)) -> 1.8125
A117: Módulo Normal | B117: mn | C117: mm | D117: =D103 -> 3
A118: Módulo Transversal | B118: mt | C118: mm | D118: =D117/(COS(RADIANS(D102))) -> 3.1058285412302489
A119: Diâmetro Primitivo | B119: d | C119: mm | D119: =D85*D118 -> 49.693256659683982 | E119: =E85*D118 -> 90.069027695677221
A120: Distância entre eixos | B120: a | C120: mm | D120: =(D119+E119)/2 -> 69.881142177680601
A121: Número Virtual de Dentes | B121: Zv | C121: - | D121: =D85/(COS(RADIANS(D102)))^3 -> 17.753690654979778 | E121: =E85/(COS(RADIANS(D102)))^3 -> 32.178564312150847
A122: Ângulo de Pressão Normal | B122: ALFA n | C122: º | D122: =D101 -> 20
A123: Ângulo de Pressão Aparente | B123: ALFA t | C123: º | D123: =DEGREES(ATAN((TAN(RADIANS(D122))/COS(RADIANS(D102))))) -> 20.646896487046469
A124: Ângulo P.Normal na Cabeça | B124: ALFA a | C124: º | D124: =DEGREES(ACOS(D135/D137)) -> 33.38855313532391 | E124: =DEGREES(ACOS(E135/E137)) -> 28.678349872000865
A125: Ângulo de Hélice na Base | B125: BETA b | C125: º | D125: =DEGREES(ASIN((SIN(RADIANS(D102))*(COS(RADIANS(D122)))))) -> 14.076095421662487
A126: Evolvente de ALFA a | B126: ev ALFA a | C126: - | D126: =TAN(RADIANS(D124))-RADIANS(D124) -> 7.6351714768445156E-2 | E126: =TAN(RADIANS(E124))-RADIANS(E124) -> 4.6461353306779918E-2
A127: Evolvente de ALFA t | B127: ev ALFA t | C127: - | D127: =TAN(RADIANS(D123))-RADIANS(D123) -> 1.6453389896665449E-2
A128: Passo Axial | B128: px | C128: mm | D128: =PI()*D117/(SIN(RADIANS(D102))) -> 36.414545757388652
A129: Passo Normal | B129: pn | C129: mm | D129: =PI()*D117 -> 9.4247779607693793
A130: Passo Normal de Base | B130: pbn | C130: mm | D130: =PI()*D117*(COS(RADIANS(D122))) -> 8.8563943022806484
A131: Passo Frontal de Base | B131: pbt | C131: mm | D131: =PI()*D118*(COS(RADIANS(D122))) -> 9.1688140654707304
A132: Grau de Recobrimento Transversal | B132: E ALFA | C132: - | D132: =(1/(2*PI()))*((D85*(TAN(RADIANS(D124))-TAN(RADIANS(D123))))+(E85*(TAN(RADIANS(E124))-TAN(RADIANS(D123))))) -> 1.5043054277147623
A133: Grau de Recobrimento Normal | B133: E BETA | C133: - | D133: =(D87*SIN(RADIANS(D102)))/(PI()*D117) -> 0.53824645048670094
A134: Grau de Recobrimento Total | B134: E | C134: - | D134: =D132+D133 -> 2.0425518782014631
A135: Diâmetro da Base | B135: db | C135: mm | D135: =D119*COS(RADIANS(D123)) -> 46.501520428750673 | E135: =E119*COS(RADIANS(D123)) -> 84.284005777110607
A136: Diâmetro do Pé | B136: df | C136: mm | D136: =D119-(2*D117*(1+0.25-D104)) -> 42.193256659683982 | E136: =E119-(2*D117*(1+0.25-E104)) -> 82.569027695677221
A137: Diâmetro da Cabeça | B137: da | C137: mm | D137: =(2*D120)-E136-(2*0.25*D117) -> 55.693256659683982 | E137: =(2*D120)-D136-(2*0.25*D117) -> 96.069027695677221
A138: Espessura Normal | B138: Sn | C138: mm | D138: =D117*((PI()/2)+(2*D104*TAN(RADIANS(D122)))) -> 4.7123889803846897 | E138: =D117*((PI()/2)+(2*E104*TAN(RADIANS(D122)))) -> 4.7123889803846897
A139: Espessura Transversal | B139: St | C139: mm | D139: =D118*((PI()/2)+(2*D104*TAN(RADIANS(D122)))) -> 4.8786240642192267 | E139: =D118*((PI()/2)+(2*E104*TAN(RADIANS(D122)))) -> 4.8786240642192267
A140: Espessura Normal na Base | B140: Sbn | C140: mm | D140: =((D138/(D117*D85))+D127)*D117*D85*COS(RADIANS(D122)) -> 5.1703313466352014 | E140: =((E138/(D117*E85))+D127)*D117*E85*COS(RADIANS(D122)) -> 5.7733153804747888
A141: Espessura Transversal no Topo | B141: Sat | C141: mm | D141: =D137*((D138/(D119*COS(RADIANS(D102))))+D127-D126) -> 2.131739906198153 | E141: =E137*((E138/(E119*COS(RADIANS(D102))))+D127-E126) -> 2.320780539756877
A142: Altura do Dente | B142: h | C142: mm | D142: =0.5*(D137-D136) -> 6.75 | E142: =0.5*(E137-E136) -> 6.75
A143: Altura Útil Comum | B143: h' | C143: mm | D143: =(0.5*(D137+E137))-D120 -> 6
A144: Altura da Cabeça (addendum) | B144: há | C144: mm | D144: =(D137-D119)/2 -> 3 | E144: =(E137-E119)/2 -> 3
A145: Altura do Pé (dedendum) | B145: hf | C145: mm | D145: =(D119-D136)/2 -> 3.75 | E145: =(E119-E136)/2 -> 3.75
A146: Velocidade Angular | B146: w | C146: rad / s | D146: =2*PI()*(D110/60) -> 17.633455539503998 | E146: =2*PI()*((D110/60)/D116) -> 9.7288030562780694
A147: Velocidade Tangencial | B147: v | C147: m / s^2 | D147: =PI()*D119*(D110/60000) -> 0.43813191596084927
A148: Potência de Saída | B148: Ps | C148: W | D148: =D109*(D105/100)*(D106/100) -> 94.128803999999988
A149: Rotação de Saída | B149: ns | C149: RPM | D149: =D110/D116 -> 92.903225806451601
A150: Momento Torsor | B150: Mt | C150: N x mm | D150: =D109/(D146*0.001) -> 5502.0412637016807 | E150: =D109/(E146*0.001) -> 9972.4497904592954
A151: Força Tangencial | B151: Ft | C151: N | D151: =D109/D147 -> 221.44015641323318 | E151: =D151*(D106/100) -> 217.01135328496852
A152: Força Axial | B152: Fa | C152: N | D152: =D151*TAN(RADIANS(D102)) -> 59.334711082747326 | E152: =D152*(D106/100) -> 58.14801686109238
A153: Força Radial | B153: Fr | C153: N | D153: =(D151*TAN(RADIANS(D122))/COS(RADIANS(D102))) -> 83.440801987158878 | E153: =D153*(D106/100) -> 81.7719859474157
A154: Fator de Engrenamento | B154: YE | C154: - | D154: =0.25+(0.75/D132) -> 0.74856896490717884
A155: Fator de Carga | B155: YV | C155: - | D155: =(D113+SQRT(D147))/D113 -> 1.1103192231612991
A156: Fator de Ângulo de Hélice | B156: YBETA | C156: - | D156: =1-(D102/120) -> 0.875
A157: Fator YBETA-H | B157: YBETA-H | C157: - | D157: =IF(D133>1,0.8,1) -> 1
A158: Flexão no Pé do Dente | B158: Fadm | C158: MPa | D158: =((D151/(D87*D117))*D111*D154*D112*D155*D156)*D107 -> 16.689810901135186 | E158: =((E151/(E87*D117))*E111*D154*D112*D155*D156)*D107 -> 17.332793146616126
A159: Desgaste no Flanco do Dente | B159: Hadm | C159: MPa | D159: =SQRT(((0.7*D114*D151*(COS(RADIANS(D102))^2)*(1+(1/D116)))/(D87*D119*SIN(RADIANS(2*D123))))*D112*D155*D157) -> 319.00267676787524 | E159: =SQRT(((0.7*D114*E151*(COS(RADIANS(D102))^2)*(1+(1/D116)))/(E87*E119*SIN(RADIANS(2*D123))))*D112*D155*D157) -> 262.50599266328265
A161: Câmbio - 2ª Marcha
A162: NOME DAS ENGRENAGENS | D162: 2ª Primário | E162: 2ª
A163: Dimensão | B163: Letra | C163: Unidade | D163: 1: Pinhão | E163: 2: Coroa
A164: Valores Medidos para Cálculo
A165: Número de Dentes | B165: Z | C165: - | D165: 23 | E165: 24
A166: Passo Transversal | B166: pt | C166: mm | D166: 9.5 | E166: 9.5
A167: Largura do Dente | B167: b | C167: mm | D167: 19 | E167: 17.35
A168: Valores Medidos para Conferência
A169: Espessura da Cabeça | B169: Sa | C169: mm | D169: 2.9 | E169: 1.9
A170: Espessura do Pé | B170: Sf | C170: mm | D170: 6 | E170: 6
A171: Altura do Dente | B171: h | C171: mm | D171: 6 | E171: 6.8
A172: Diâmetro da Cabeça | B172: da | C172: mm | D172: 73 | E172: 77.45
A173: Diâmetro do Pé | B173: df | C173: mm | D173: 60.75 | E173: 65.25
A174: Largura Transversal do Dente | B174: bt | C174: mm | D174: 23 | E174: 20
A175: Valores Estipulados
A176: Ângulo de Pressão | B176: ALFA | C176: º | D176: =DEGREES(ATAN(((D170/2)-(D169/2))/D171)) -> 14.484733560322971 | E176: =DEGREES(ATAN(((E170/2)-(E169/2))/E171)) -> 16.776514287637831
A177: Ângulo de Hélice | B177: BETA | C177: º | D177: =DEGREES(ATAN((D166/2)/D167)) -> 14.036243467926479 | E177: =DEGREES(ATAN((E166/2)/E167)) -> 15.31098975264578
A178: Módulo Transversal | B178: mt | C178: mm | D178: =D166/PI() -> 3.0239439187460113 | E178: =E166/PI() -> 3.0239439187460113
A179: Módulo Normal | B179: mn | C179: mm | D179: =D178*(COS(RADIANS(D182))) -> 2.9209055283665442 | E179: =E178*(COS(RADIANS(D182))) -> 2.9209055283665442
A180: Valores Adotados
A181: Ângulo de Pressão | B181: ALFA | C181: º | D181: 20
A182: Ângulo de Hélice | B182: BETA | C182: º | D182: 15
A183: Módulo (Normalizado) | B183: m | C183: mm | D183: 3
A184: Coeficiente de Deslocamento | B184: x | C184: - | D184: =Geral!$D$13 -> 0 | E184: =Geral!$E$13 -> 0
A185: Rendimento de Rolamento | B185: ETA r | C185: % | D185: =Geral!$D$3 -> 99
A186: Rendimento do Par Engrenado | B186: ETA e | C186: % | D186: =Geral!$D$4 -> 98
A187: Coeficiente de Segurança | B187: Kf | C187: - | D187: =Geral!$D$5 -> 1.5
A188: Valores Adicionais
A189: Potência de Entrada | B189: Pe | C189: W | D189: =$D$68 -> 97.02
A190: Rotação de Entrada | B190: ne | C190: RPM | D190: =$D$69 -> 168.38709677419354
A191: Fator de Forma do Dente | B191: Yf | C191: - | D191: =Geral!$D$14 -> 3.25 | E191: =Geral!$E$14 -> 2.75
A192: Fator de Serviço | B192: Ys | C192: - | D192: =Geral!$D$15 -> 1.25
A193: Precisão do Dente | B193: a* | C193: - | D193: =Geral!$D$16 -> 6
A194: Módulo de Elasticidade Equivalente | B194: Ec | C194: MPa | D194: =Geral!$D$6 -> 210000
A195: Valores Calculados
A196: Relação de Transmissão | B196: i | C196: - | D196: =IF((E165/D165),(E165/D165),(E172/D172)) -> 1.0434782608695652
A197: Módulo Normal | B197: mn | C197: mm | D197: =D183 -> 3
A198: Módulo Transversal | B198: mt | C198: mm | D198: =D197/(COS(RADIANS(D182))) -> 3.1058285412302489
A199: Diâmetro Primitivo | B199: d | C199: mm | D199: =D165*D198 -> 71.434056448295721 | E199: =E165*D198 -> 74.539884989525973
A200: Distância entre eixos | B200: a | C200: mm | D200: =(D199+E199)/2 -> 72.98697071891084
A201: Número Virtual de Dentes | B201: Zv | C201: - | D201: =D165/(COS(RADIANS(D182)))^3 -> 25.520930316533427 | E201: =E165/(COS(RADIANS(D182)))^3 -> 26.630535982469663
A202: Ângulo de Pressão Normal | B202: ALFA n | C202: º | D202: =D181 -> 20
A203: Ângulo de Pressão Aparente | B203: ALFA t | C203: º | D203: =DEGREES(ATAN((TAN(RADIANS(D202))/COS(RADIANS(D182))))) -> 20.646896487046469
A204: Ângulo P.Normal na Cabeça | B204: ALFA a | C204: º | D204: =DEGREES(ACOS(D215/D217)) -> 30.315079183823535 | E204: =DEGREES(ACOS(E215/E217)) -> 29.996166455218859
A205: Ângulo de Hélice na Base | B205: BETA b | C205: º | D205: =DEGREES(ASIN((SIN(RADIANS(D182))*(COS(RADIANS(D202)))))) -> 14.076095421662487
A206: Evolvente de ALFA a | B206: ev ALFA a | C206: - | D206: =TAN(RADIANS(D204))-RADIANS(D204) -> 5.5607977934511998E-2 | E206: =TAN(RADIANS(E204))-RADIANS(E204) -> 5.3729194377724165E-2
A207: Evolvente de ALFA t | B207: ev ALFA t | C207: - | D207: =TAN(RADIANS(D203))-RADIANS(D203) -> 1.6453389896665449E-2
A208: Passo Axial | B208: px | C208: mm | D208: =PI()*D197/(SIN(RADIANS(D182))) -> 36.414545757388652
A209: Passo Normal | B209: pn | C209: mm | D209: =PI()*D197 -> 9.4247779607693793
A210: Passo Normal de Base | B210: pbn | C210: mm | D210: =PI()*D197*(COS(RADIANS(D202))) -> 8.8563943022806484
A211: Passo Frontal de Base | B211: pbt | C211: mm | D211: =PI()*D198*(COS(RADIANS(D202))) -> 9.1688140654707304
A212: Grau de Recobrimento Transversal | B212: E ALFA | C212: - | D212: =(1/(2*PI()))*((D165*(TAN(RADIANS(D204))-TAN(RADIANS(D203))))+(E165*(TAN(RADIANS(E204))-TAN(RADIANS(D203))))) -> 1.5266850629098461
A213: Grau de Recobrimento Normal | B213: E BETA | C213: - | D213: =(D167*SIN(RADIANS(D182)))/(PI()*D197) -> 0.5217695183289448
A214: Grau de Recobrimento Total | B214: E | C214: - | D214: =D212+D213 -> 2.0484545812387909
A215: Diâmetro da Base | B215: db | C215: mm | D215: =D199*COS(RADIANS(D203)) -> 66.845935616329086 | E215: =E199*COS(RADIANS(D203)) -> 69.752280643126014
A216: Diâmetro do Pé | B216: df | C216: mm | D216: =D199-(2*D197*(1+0.25-D184)) -> 63.934056448295721 | E216: =E199-(2*D197*(1+0.25-E184)) -> 67.039884989525973
A217: Diâmetro da Cabeça | B217: da | C217: mm | D217: =(2*D200)-E216-(2*0.25*D197) -> 77.434056448295706 | E217: =(2*D200)-D216-(2*0.25*D197) -> 80.539884989525959
A218: Espessura Normal | B218: Sn | C218: mm | D218: =D197*((PI()/2)+(2*D184*TAN(RADIANS(D202)))) -> 4.7123889803846897 | E218: =D197*((PI()/2)+(2*E184*TAN(RADIANS(D202)))) -> 4.7123889803846897
A219: Espessura Transversal | B219: St | C219: mm | D219: =D198*((PI()/2)+(2*D184*TAN(RADIANS(D202)))) -> 4.8786240642192267 | E219: =D198*((PI()/2)+(2*E184*TAN(RADIANS(D202)))) -> 4.8786240642192267
A220: Espessura Normal na Base | B220: Sbn | C220: mm | D220: =((D218/(D197*D165))+D207)*D197*D165*COS(RADIANS(D202)) -> 5.4950150571642107 | E220: =((E218/(D197*E165))+D207)*D197*E165*COS(RADIANS(D202)) -> 5.5413984443826401
A221: Espessura Transversal no Topo | B221: Sat | C221: mm | D221: =D217*((D218/(D199*COS(RADIANS(D182))))+D207-D206) -> 2.2564984387029132 | E221: =E217*((E218/(E199*COS(RADIANS(D182))))+D207-E206) -> 2.2691341401214244
A222: Altura do Dente | B222: h | C222: mm | D222: =0.5*(D217-D216) -> 6.7499999999999929 | E222: =0.5*(E217-E216) -> 6.7499999999999929
A223: Altura Útil Comum | B223: h' | C223: mm | D223: =(0.5*(D217+E217))-D200 -> 6
A224: Altura da Cabeça (addendum) | B224: há | C224: mm | D224: =(D217-D199)/2 -> 2.9999999999999929 | E224: =(E217-E199)/2 -> 2.9999999999999929
A225: Altura do Pé (dedendum) | B225: hf | C225: mm | D225: =(D199-D216)/2 -> 3.75 | E225: =(E199-E216)/2 -> 3.75
A226: Velocidade Angular | B226: w | C226: rad / s | D226: =2*PI()*(D190/60) -> 17.633455539503998 | E226: =2*PI()*((D190/60)/D196) -> 16.898728225357999
A227: Velocidade Tangencial | B227: v | C227: m / s^2 | D227: =PI()*D199*(D190/60000) -> 0.62981462919372078
A228: Potência de Saída | B228: Ps | C228: W | D228: =D189*(D185/100)*(D186/100) -> 94.128803999999988
A229: Rotação de Saída | B229: ns | C229: RPM | D229: =D190/D196 -> 161.37096774193549
A230: Momento Torsor | B230: Mt | C230: N x mm | D230: =D189/(D226*0.001) -> 5502.0412637016807 | E230: =D189/(E226*0.001) -> 5741.2604490800159
A231: Força Tangencial | B231: Ft | C231: N | D231: =D189/D227 -> 154.04532620051006 | E231: =D231*(D186/100) -> 150.96441967649986
A232: Força Axial | B232: Fa | C232: N | D232: =D231*TAN(RADIANS(D182)) -> 41.276320753215536 | E232: =D232*(D186/100) -> 40.450794338151226
A233: Força Radial | B233: Fr | C233: N | D233: =(D231*TAN(RADIANS(D202))/COS(RADIANS(D182))) -> 58.045775295414877 | E233: =D233*(D186/100) -> 56.884859789506578
A234: Fator de Engrenamento | B234: YE | C234: - | D234: =0.25+(0.75/D212) -> 0.74126045588636846
A235: Fator de Carga | B235: YV | C235: - | D235: =(D193+SQRT(D227))/D193 -> 1.1322681020160821
A236: Fator de Ângulo de Hélice | B236: YBETA | C236: - | D236: =1-(D182/120) -> 0.875
A237: Fator YBETA-H | B237: YBETA-H | C237: - | D237: =IF(D213>1,0.8,1) -> 1
A238: Flexão no Pé do Dente | B238: Fadm | C238: MPa | D238: =((D231/(D167*D197))*D191*D234*D192*D235*D236)*D187 -> 12.094459417390699 | E238: =((E231/(E167*D197))*E191*D234*D192*D235*D236)*D187 -> 10.982873765772389
A239: Desgaste no Flanco do Dente | B239: Hadm | C239: MPa | D239: =SQRT(((0.7*D194*D231*(COS(RADIANS(D182))^2)*(1+(1/D196)))/(D167*D199*SIN(RADIANS(2*D203))))*D192*D235*D237) -> 255.69631321381496 | E239: =SQRT(((0.7*D194*E231*(COS(RADIANS(D182))^2)*(1+(1/D196)))/(E167*E199*SIN(RADIANS(2*D203))))*D192*D235*D237) -> 259.31214764994957
A241: Câmbio - 3ª Marcha
A242: NOME DAS ENGRENAGENS | D242: 3ª Primário | E242: 3ª
A243: Dimensão | B243: Letra | C243: Unidade | D243: 1: Pinhão | E243: 2: Coroa
A244: Valores Medidos para Cálculo
A245: Número de Dentes | B245: Z | C245: - | D245: 27 | E245: 18
A246: Passo Transversal | B246: pt | C246: mm | D246: 10 | E246: 10
A247: Largura do Dente | B247: b | C247: mm | D247: 20.65 | E247: 19.5
A248: Valores Medidos para Conferência
A249: Espessura da Cabeça | B249: Sa | C249: mm | D249: 1.88 | E249: 1.7
A250: Espessura do Pé | B250: Sf | C250: mm | D250: 5.64 | E250: 6.2
A251: Altura do Dente | B251: h | C251: mm | D251: 6 | E251: 6.5
A252: Diâmetro da Cabeça | B252: da | C252: mm | D252: 88.35 | E252: 62.5
A253: Diâmetro do Pé | B253: df | C253: mm | D253: 75.9 | E253: 49.5
A254: Largura Transversal do Dente | B254: bt | C254: mm | D254: 22.6 | E254: 16.5
A255: Valores Estipulados
A256: Ângulo de Pressão | B256: ALFA | C256: º | D256: =DEGREES(ATAN(((D250/2)-(D249/2))/D251)) -> 17.39751288560505 | E256: =DEGREES(ATAN(((E250/2)-(E249/2))/E251)) -> 19.093492000485615
A257: Ângulo de Hélice | B257: BETA | C257: º | D257: =DEGREES(ATAN((D246/2)/D247)) -> 13.611111353606882 | E257: =DEGREES(ATAN((E246/2)/E247)) -> 14.381394591090604
A258: Módulo Transversal | B258: mt | C258: mm | D258: =D246/PI() -> 3.183098861837907 | E258: =E246/PI() -> 3.183098861837907
A259: Módulo Normal | B259: mn | C259: mm | D259: =D258*(COS(RADIANS(D262))) -> 3.074637398280573 | E259: =E258*(COS(RADIANS(D262))) -> 3.074637398280573
A260: Valores Adotados
A261: Ângulo de Pressão | B261: ALFA | C261: º | D261: 20
A262: Ângulo de Hélice | B262: BETA | C262: º | D262: 15
A263: Módulo (Normalizado) | B263: m | C263: mm | D263: 3
A264: Coeficiente de Deslocamento | B264: x | C264: - | D264: =Geral!$D$13 -> 0 | E264: =Geral!$E$13 -> 0
A265: Rendimento de Rolamento | B265: ETA r | C265: % | D265: =Geral!$D$3 -> 99
A266: Rendimento do Par Engrenado | B266: ETA e | C266: % | D266: =Geral!$D$4 -> 98
A267: Coeficiente de Segurança | B267: Kf | C267: - | D267: =Geral!$D$5 -> 1.5
A268: Valores Adicionais
A269: Potência de Entrada | B269: Pe | C269: W | D269: =$D$68 -> 97.02
A270: Rotação de Entrada | B270: ne | C270: RPM | D270: =$D$69 -> 168.38709677419354
A271: Fator de Forma do Dente | B271: Yf | C271: - | D271: =Geral!$D$14 -> 3.25 | E271: =Geral!$E$14 -> 2.75
A272: Fator de Serviço | B272: Ys | C272: - | D272: =Geral!$D$15 -> 1.25
A273: Precisão do Dente | B273: a* | C273: - | D273: =Geral!$D$16 -> 6
A274: Módulo de Elasticidade Equivalente | B274: Ec | C274: MPa | D274: =Geral!$D$6 -> 210000
A275: Valores Calculados
A276: Relação de Transmissão | B276: i | C276: - | D276: =IF((E245/D245),(E245/D245),(E252/D252)) -> 0.66666666666666663
A277: Módulo Normal | B277: mn | C277: mm | D277: =D263 -> 3
A278: Módulo Transversal | B278: mt | C278: mm | D278: =D277/(COS(RADIANS(D262))) -> 3.1058285412302489
A279: Diâmetro Primitivo | B279: d | C279: mm | D279: =D245*D278 -> 83.857370613216716 | E279: =E245*D278 -> 55.90491374214448
A280: Distância entre eixos | B280: a | C280: mm | D280: =(D279+E279)/2 -> 69.881142177680601
A281: Número Virtual de Dentes | B281: Zv | C281: - | D281: =D245/(COS(RADIANS(D262)))^3 -> 29.959352980278371 | E281: =E245/(COS(RADIANS(D262)))^3 -> 19.97290198685225
A282: Ângulo de Pressão Normal | B282: ALFA n | C282: º | D282: =D261 -> 20
A283: Ângulo de Pressão Aparente | B283: ALFA t | C283: º | D283: =DEGREES(ATAN((TAN(RADIANS(D282))/COS(RADIANS(D262))))) -> 20.646896487046469
A284: Ângulo P.Normal na Cabeça | B284: ALFA a | C284: º | D284: =DEGREES(ACOS(D295/D297)) -> 29.157058483793474 | E284: =DEGREES(ACOS(E295/E297)) -> 32.320173880109856
A285: Ângulo de Hélice na Base | B285: BETA b | C285: º | D285: =DEGREES(ASIN((SIN(RADIANS(D262))*(COS(RADIANS(D282)))))) -> 14.076095421662487
A286: Evolvente de ALFA a | B286: ev ALFA a | C286: - | D286: =TAN(RADIANS(D284))-RADIANS(D284) -> 4.90112838527057E-2 | E286: =TAN(RADIANS(E284))-RADIANS(E284) -> 6.8573233879780315E-2
A287: Evolvente de ALFA t | B287: ev ALFA t | C287: - | D287: =TAN(RADIANS(D283))-RADIANS(D283) -> 1.6453389896665449E-2
A288: Passo Axial | B288: px | C288: mm | D288: =PI()*D277/(SIN(RADIANS(D262))) -> 36.414545757388652
A289: Passo Normal | B289: pn | C289: mm | D289: =PI()*D277 -> 9.4247779607693793
A290: Passo Normal de Base | B290: pbn | C290: mm | D290: =PI()*D277*(COS(RADIANS(D282))) -> 8.8563943022806484
A291: Passo Frontal de Base | B291: pbt | C291: mm | D291: =PI()*D278*(COS(RADIANS(D282))) -> 9.1688140654707304
A292: Grau de Recobrimento Transversal | B292: E ALFA | C292: - | D292: =(1/(2*PI()))*((D245*(TAN(RADIANS(D284))-TAN(RADIANS(D283))))+(E245*(TAN(RADIANS(E284))-TAN(RADIANS(D283))))) -> 1.5111456173785047
A293: Grau de Recobrimento Normal | B293: E BETA | C293: - | D293: =(D247*SIN(RADIANS(D262)))/(PI()*D277) -> 0.56708108176277428
A294: Grau de Recobrimento Total | B294: E | C294: - | D294: =D292+D293 -> 2.078226699141279
A295: Diâmetro da Base | B295: db | C295: mm | D295: =D279*COS(RADIANS(D283)) -> 78.471315723516767 | E295: =E279*COS(RADIANS(D283)) -> 52.314210482344514
A296: Diâmetro do Pé | B296: df | C296: mm | D296: =D279-(2*D277*(1+0.25-D264)) -> 76.357370613216716 | E296: =E279-(2*D277*(1+0.25-E264)) -> 48.40491374214448
A297: Diâmetro da Cabeça | B297: da | C297: mm | D297: =(2*D280)-E296-(2*0.25*D277) -> 89.857370613216716 | E297: =(2*D280)-D296-(2*0.25*D277) -> 61.904913742144487
A298: Espessura Normal | B298: Sn | C298: mm | D298: =D277*((PI()/2)+(2*D264*TAN(RADIANS(D282)))) -> 4.7123889803846897 | E298: =D277*((PI()/2)+(2*E264*TAN(RADIANS(D282)))) -> 4.7123889803846897
A299: Espessura Transversal | B299: St | C299: mm | D299: =D278*((PI()/2)+(2*D264*TAN(RADIANS(D282)))) -> 4.8786240642192267 | E299: =D278*((PI()/2)+(2*E264*TAN(RADIANS(D282)))) -> 4.8786240642192267
A300: Espessura Normal na Base | B300: Sbn | C300: mm | D300: =((D298/(D277*D245))+D287)*D277*D245*COS(RADIANS(D282)) -> 5.68054860603793 | E300: =((E298/(D277*E245))+D287)*D277*E245*COS(RADIANS(D282)) -> 5.2630981210720611
A301: Espessura Transversal no Topo | B301: Sat | C301: mm | D301: =D297*((D298/(D279*COS(RADIANS(D262))))+D287-D286) -> 2.3021231710243759 | E301: =E297*((E298/(E279*COS(RADIANS(D262))))+D287-E286) -> 2.1757483937887723
A302: Altura do Dente | B302: h | C302: mm | D302: =0.5*(D297-D296) -> 6.75 | E302: =0.5*(E297-E296) -> 6.75
A303: Altura Útil Comum | B303: h' | C303: mm | D303: =(0.5*(D297+E297))-D280 -> 6
A304: Altura da Cabeça (addendum) | B304: há | C304: mm | D304: =(D297-D279)/2 -> 3 | E304: =(E297-E279)/2 -> 3
A305: Altura do Pé (dedendum) | B305: hf | C305: mm | D305: =(D279-D296)/2 -> 3.75 | E305: =(E279-E296)/2 -> 3.75
A306: Velocidade Angular | B306: w | C306: rad / s | D306: =2*PI()*(D270/60) -> 17.633455539503998 | E306: =2*PI()*((D270/60)/D276) -> 26.450183309256001
A307: Velocidade Tangencial | B307: v | C307: m / s^2 | D307: =PI()*D279*(D270/60000) -> 0.73934760818393319
A308: Potência de Saída | B308: Ps | C308: W | D308: =D269*(D265/100)*(D266/100) -> 94.128803999999988
A309: Rotação de Saída | B309: ns | C309: RPM | D309: =D270/D276 -> 252.58064516129031
A310: Momento Torsor | B310: Mt | C310: N x mm | D310: =D269/(D306*0.001) -> 5502.0412637016807 | E310: =D269/(E306*0.001) -> 3668.0275091344538
A311: Força Tangencial | B311: Ft | C311: N | D311: =D269/D307 -> 131.22379639302707 | E311: =D311*(D266/100) -> 128.59932046516653
A312: Força Axial | B312: Fa | C312: N | D312: =D311*TAN(RADIANS(D262)) -> 35.161310271257676 | E312: =D312*(D266/100) -> 34.458084065832523
A313: Força Radial | B313: Fr | C313: N | D313: =(D311*TAN(RADIANS(D282))/COS(RADIANS(D262))) -> 49.44640117757563 | E313: =D313*(D266/100) -> 48.457473154024115
A314: Fator de Engrenamento | B314: YE | C314: - | D314: =0.25+(0.75/D292) -> 0.74631219610793043
A315: Fator de Carga | B315: YV | C315: - | D315: =(D273+SQRT(D307))/D273 -> 1.1433088746751743
A316: Fator de Ângulo de Hélice | B316: YBETA | C316: - | D316: =1-(D262/120) -> 0.875
A317: Fator YBETA-H | B317: YBETA-H | C317: - | D317: =IF(D293>1,0.8,1) -> 1
A318: Flexão no Pé do Dente | B318: Fadm | C318: MPa | D318: =((D311/(D247*D277))*D271*D314*D272*D315*D316)*D267 -> 9.6371381974410113 | E318: =((E311/(E247*D277))*E271*D314*D272*D315*D316)*D267 -> 8.4626998923777137
A319: Desgaste no Flanco do Dente | B319: Hadm | C319: MPa | D319: =SQRT(((0.7*D274*D311*(COS(RADIANS(D262))^2)*(1+(1/D276)))/(D247*D279*SIN(RADIANS(2*D283))))*D272*D315*D317) -> 237.21336687447547 | E319: =SQRT(((0.7*D274*E311*(COS(RADIANS(D262))^2)*(1+(1/D276)))/(E247*E279*SIN(RADIANS(2*D283))))*D272*D315*D317) -> 295.96513067433102
A321: Câmbio - 4ª Marcha
A322: NOME DAS ENGRENAGENS | D322: 4ª | E322: -
A323: Dimensão | B323: Letra | C323: Unidade | D323: 1: Pinhão | E323: 2: Coroa
A324: Valores Adotados
A325: Rendimento de Rolamento | B325: ETA r | C325: % | D325: =Geral!$D$3 -> 99
A326: Rendimento do Par Engrenado | B326: ETA e | C326: % | D326: =Geral!$D$4 -> 98
A327: Valores Adicionais
A328: Potência de Entrada | B328: Pe | C328: W | D328: =Geral!$D$9 -> 100
A329: Rotação de Entrada | B329: ne | C329: RPM | D329: =Geral!$D$10 -> 348
A330: Diâmetro do Eixo de Saída | B330: D | C330: mm | D330: 37
A331: Valores Calculados
A332: Velocidade Angular | B332: w | C332: rad / s | D332: =2*PI()*(D329/60) -> 36.4424747816416
A333: Velocidade Tangencial | B333: v | C333: m / s^2 | D333: =PI()*D330*(D329/60000) -> 0.67418578346036961
A334: Potência de Saída | B334: Ps | C334: W | D334: =D328*(D325/100)*(D326/100) -> 97.02
A335: Rotação de Saída | B335: ns | C335: RPM | D335: =D329 -> 348
A336: Momento Torsor | B336: Mt | C336: N x mm | D336: =D328/(D332*0.001) -> 2744.0507429637128
A337: Força Tangencial | B337: Ft | C337: N | D337: =D328/D333 -> 148.32706718722773
A339: Câmbio - Marcha Ré - I
A340: NOME DAS ENGRENAGENS | D340: Ré-A | E340: Ré-B
A341: Dimensão | B341: Letra | C341: Unidade | D341: 1: Pinhão | E341: 2: Coroa
A342: Valores Medidos para Cálculo
A343: Número de Dentes | B343: Z | C343: - | D343: 13 | E343: 17
A344: Passo Transversal | B344: pt | C344: mm | D344: 9.5 | E344: 9.2
A345: Largura do Dente | B345: b | C345: mm | D345: 24.4 | E345: 20.75
A346: Valores Medidos para Conferência
A347: Espessura da Cabeça | B347: Sa | C347: mm | D347: 1.1 | E347: 2
A348: Espessura do Pé | B348: Sf | C348: mm | D348: 6 | E348: 6.05
A349: Altura do Dente | B349: h | C349: mm | D349: 7.1 | E349: 6.6
A350: Diâmetro da Cabeça | B350: da | C350: mm | D350: 49.15 | E350: 60.55
A351: Diâmetro do Pé | B351: df | C351: mm | D351: 35.1 | E351: 47.8
A352: Largura Transversal do Dente | B352: bt | C352: mm | D352: 9.05 | E352: 10
A353: Valores Estipulados
A354: Ângulo de Pressão | B354: ALFA | C354: º | D354: =DEGREES(ATAN(((D348/2)-(D347/2))/D349)) -> 19.038040017302546 | E354: =DEGREES(ATAN(((E348/2)-(E347/2))/E349)) -> 17.056965576617063
A355: Ângulo de Hélice | B355: BETA | C355: º | D355: =DEGREES(ATAN((D344/2)/D345)) -> 11.01611053936951 | E355: =DEGREES(ATAN((E344/2)/E345)) -> 12.499567711938433
A356: Módulo Transversal | B356: mt | C356: mm | D356: =D344/PI() -> 3.0239439187460113 | E356: =E344/PI() -> 2.928450952890874
A357: Módulo Normal | B357: mn | C357: mm | D357: =D356*(COS(RADIANS(D360))) -> 2.9209055283665442 | E357: =E356*(COS(RADIANS(D360))) -> 2.8286664064181268
A358: Valores Adotados
A359: Ângulo de Pressão | B359: ALFA | C359: º | D359: 20
A360: Ângulo de Hélice | B360: BETA | C360: º | D360: 15
A361: Módulo (Normalizado) | B361: m | C361: mm | D361: 3
A362: Coeficiente de Deslocamento | B362: x | C362: - | D362: =Geral!$D$13 -> 0 | E362: =Geral!$E$13 -> 0
A363: Rendimento de Rolamento | B363: ETA r | C363: % | D363: =Geral!$D$3 -> 99
A364: Rendimento do Par Engrenado | B364: ETA e | C364: % | D364: =Geral!$D$4 -> 98
A365: Coeficiente de Segurança | B365: Kf | C365: - | D365: =Geral!$D$5 -> 1.5
A366: Valores Adicionais
A367: Potência de Entrada | B367: Pe | C367: W | D367: =$D$68 -> 97.02
A368: Rotação de Entrada | B368: ne | C368: RPM | D368: =$D$69 -> 168.38709677419354
A369: Fator de Forma do Dente | B369: Yf | C369: - | D369: =Geral!$D$14 -> 3.25 | E369: =Geral!$E$14 -> 2.75
A370: Fator de Serviço | B370: Ys | C370: - | D370: =Geral!$D$15 -> 1.25
A371: Precisão do Dente | B371: a* | C371: - | D371: =Geral!$D$16 -> 6
A372: Módulo de Elasticidade Equivalente | B372: Ec | C372: MPa | D372: =Geral!$D$6 -> 210000
A373: Valores Calculados
A374: Relação de Transmissão | B374: i | C374: - | D374: =IF((E343/D343),(E343/D343),(E350/D350)) -> 1.3076923076923077
A375: Módulo Normal | B375: mn | C375: mm | D375: =D361 -> 3
A376: Módulo Transversal | B376: mt | C376: mm | D376: =D375/(COS(RADIANS(D360))) -> 3.1058285412302489
A377: Diâmetro Primitivo | B377: d | C377: mm | D377: =D343*D376 -> 40.375771035993239 | E377: =E343*D376 -> 52.799085200914234
A378: Distância entre eixos | B378: a | C378: mm | D378: =(D377+E377)/2 -> 46.587428118453737
A379: Número Virtual de Dentes | B379: Zv | C379: - | D379: =D343/(COS(RADIANS(D360)))^3 -> 14.424873657171068 | E379: =E343/(COS(RADIANS(D360)))^3 -> 18.863296320916014
A380: Ângulo de Pressão Normal | B380: ALFA n | C380: º | D380: =D359 -> 20
A381: Ângulo de Pressão Aparente | B381: ALFA t | C381: º | D381: =DEGREES(ATAN((TAN(RADIANS(D380))/COS(RADIANS(D360))))) -> 20.646896487046469
A382: Ângulo P.Normal na Cabeça | B382: ALFA a | C382: º | D382: =DEGREES(ACOS(D393/D395)) -> 35.441982376763079 | E382: =DEGREES(ACOS(E393/E395)) -> 32.829995444836591
A383: Ângulo de Hélice na Base | B383: BETA b | C383: º | D383: =DEGREES(ASIN((SIN(RADIANS(D360))*(COS(RADIANS(D380)))))) -> 14.076095421662487
A384: Evolvente de ALFA a | B384: ev ALFA a | C384: - | D384: =TAN(RADIANS(D382))-RADIANS(D382) -> 9.3187088637559423E-2 | E384: =TAN(RADIANS(E382))-RADIANS(E382) -> 7.2205708287767068E-2
A385: Evolvente de ALFA t | B385: ev ALFA t | C385: - | D385: =TAN(RADIANS(D381))-RADIANS(D381) -> 1.6453389896665449E-2
A386: Passo Axial | B386: px | C386: mm | D386: =PI()*D375/(SIN(RADIANS(D360))) -> 36.414545757388652
A387: Passo Normal | B387: pn | C387: mm | D387: =PI()*D375 -> 9.4247779607693793
A388: Passo Normal de Base | B388: pbn | C388: mm | D388: =PI()*D375*(COS(RADIANS(D380))) -> 8.8563943022806484
A389: Passo Frontal de Base | B389: pbt | C389: mm | D389: =PI()*D376*(COS(RADIANS(D380))) -> 9.1688140654707304
A390: Grau de Recobrimento Transversal | B390: E ALFA | C390: - | D390: =(1/(2*PI()))*((D343*(TAN(RADIANS(D382))-TAN(RADIANS(D381))))+(E343*(TAN(RADIANS(E382))-TAN(RADIANS(D381))))) -> 1.4191884837676763
A391: Grau de Recobrimento Normal | B391: E BETA | C391: - | D391: =(D345*SIN(RADIANS(D360)))/(PI()*D375) -> 0.67006190774875019
A392: Grau de Recobrimento Total | B392: E | C392: - | D392: =D390+D391 -> 2.0892503915164262
A393: Diâmetro da Base | B393: db | C393: mm | D393: =D377*COS(RADIANS(D381)) -> 37.782485348359927 | E393: =E377*COS(RADIANS(D381)) -> 49.407865455547594
A394: Diâmetro do Pé | B394: df | C394: mm | D394: =D377-(2*D375*(1+0.25-D362)) -> 32.875771035993239 | E394: =E377-(2*D375*(1+0.25-E362)) -> 45.299085200914234
A395: Diâmetro da Cabeça | B395: da | C395: mm | D395: =(2*D378)-E394-(2*0.25*D375) -> 46.375771035993239 | E395: =(2*D378)-D394-(2*0.25*D375) -> 58.799085200914234
A396: Espessura Normal | B396: Sn | C396: mm | D396: =D375*((PI()/2)+(2*D362*TAN(RADIANS(D380)))) -> 4.7123889803846897 | E396: =D375*((PI()/2)+(2*E362*TAN(RADIANS(D380)))) -> 4.7123889803846897
A397: Espessura Transversal | B397: St | C397: mm | D397: =D376*((PI()/2)+(2*D362*TAN(RADIANS(D380)))) -> 4.8786240642192267 | E397: =D376*((PI()/2)+(2*E362*TAN(RADIANS(D380)))) -> 4.8786240642192267
A398: Espessura Normal na Base | B398: Sbn | C398: mm | D398: =((D396/(D375*D343))+D385)*D375*D343*COS(RADIANS(D380)) -> 5.0311811849799115 | E398: =((E396/(D375*E343))+D385)*D375*E343*COS(RADIANS(D380)) -> 5.2167147338536308
A399: Espessura Transversal no Topo | B399: Sat | C399: mm | D399: =D395*((D396/(D377*COS(RADIANS(D360))))+D385-D384) -> 2.0450225407258289 | E399: =E395*((E396/(E377*COS(RADIANS(D360))))+D385-E384) -> 2.1548374485670152
A400: Altura do Dente | B400: h | C400: mm | D400: =0.5*(D395-D394) -> 6.75 | E400: =0.5*(E395-E394) -> 6.75
A401: Altura Útil Comum | B401: h' | C401: mm | D401: =(0.5*(D395+E395))-D378 -> 6
A402: Altura da Cabeça (addendum) | B402: há | C402: mm | D402: =(D395-D377)/2 -> 3 | E402: =(E395-E377)/2 -> 3
A403: Altura do Pé (dedendum) | B403: hf | C403: mm | D403: =(D377-D394)/2 -> 3.75 | E403: =(E377-E394)/2 -> 3.75
A404: Velocidade Angular | B404: w | C404: rad / s | D404: =2*PI()*(D368/60) -> 17.633455539503998 | E404: =2*PI()*((D368/60)/D374) -> 13.484407177267764
A405: Velocidade Tangencial | B405: v | C405: m / s^2 | D405: =PI()*D377*(D368/60000) -> 0.35598218171819007
A406: Potência de Saída | B406: Ps | C406: W | D406: =D367*(D363/100)*(D364/100) -> 94.128803999999988
A407: Rotação de Saída | B407: ns | C407: RPM | D407: =D368/D374 -> 128.76660341555976
A408: Momento Torsor | B408: Mt | C408: N x mm | D408: =D367/(D404*0.001) -> 5502.0412637016807 | E408: =D367/(E404*0.001) -> 7194.9770371483519
A409: Força Tangencial | B409: Ft | C409: N | D409: =D367/D405 -> 272.54173097013313 | E409: =D409*(D364/100) -> 267.09089635073047
A410: Força Axial | B410: Fa | C410: N | D410: =D409*TAN(RADIANS(D360)) -> 73.02733671722747 | E410: =D410*(D364/100) -> 71.566789982882923
A411: Força Radial | B411: Fr | C411: N | D411: =(D409*TAN(RADIANS(D380))/COS(RADIANS(D360))) -> 102.69637167650322 | E411: =D411*(D364/100) -> 100.64244424297316
A412: Fator de Engrenamento | B412: YE | C412: - | D412: =0.25+(0.75/D390) -> 0.77847103015442476
A413: Fator de Carga | B413: YV | C413: - | D413: =(D371+SQRT(D405))/D371 -> 1.0994404039443546
A414: Fator de Ângulo de Hélice | B414: YBETA | C414: - | D414: =1-(D360/120) -> 0.875
A415: Fator YBETA-H | B415: YBETA-H | C415: - | D415: =IF(D391>1,0.8,1) -> 1
A416: Flexão no Pé do Dente | B416: Fadm | C416: MPa | D416: =((D409/(D345*D375))*D369*D412*D370*D413*D414)*D365 -> 16.991384332355171 | E416: =((E409/(E345*D375))*E369*D412*D370*D413*D414)*D365 -> 16.568221700493211
A417: Desgaste no Flanco do Dente | B417: Hadm | C417: MPa | D417: =SQRT(((0.7*D372*D409*(COS(RADIANS(D360))^2)*(1+(1/D374)))/(D345*D377*SIN(RADIANS(2*D381))))*D370*D413*D415) -> 373.41770538705975 | E417: =SQRT(((0.7*D372*E409*(COS(RADIANS(D360))^2)*(1+(1/D374)))/(E345*E377*SIN(RADIANS(2*D381))))*D370*D413*D415) -> 350.54277624230366
A419: Câmbio - Marcha Ré - II
A420: NOME DAS ENGRENAGENS | D420: Ré-B | E420: Ré-C
A421: Dimensão | B421: Letra | C421: Unidade | D421: 1: Pinhão | E421: 2: Coroa
A422: Valores Medidos para Cálculo
A423: Número de Dentes | B423: Z | C423: - | D423: 17 | E423: 24
A424: Passo Transversal | B424: pt | C424: mm | D424: 9.2 | E424: 9.5
A425: Largura do Dente | B425: b | C425: mm | D425: 20.75 | E425: 15.25
A426: Valores Medidos para Conferência
A427: Espessura da Cabeça | B427: Sa | C427: mm | D427: 2 | E427: 1.85
A428: Espessura do Pé | B428: Sf | C428: mm | D428: 6.05 | E428: 8.05
A429: Altura do Dente | B429: h | C429: mm | D429: 6.6 | E429: 6.55
A430: Diâmetro da Cabeça | B430: da | C430: mm | D430: 60.55 | E430: 86.35
A431: Diâmetro do Pé | B431: df | C431: mm | D431: 47.8 | E431: 73.2
A432: Largura Transversal do Dente | B432: bt | C432: mm | D432: 10 | E432: 6
A433: Valores Estipulados
A434: Ângulo de Pressão | B434: ALFA | C434: º | D434: =DEGREES(ATAN(((D428/2)-(D427/2))/D429)) -> 17.056965576617063 | E434: =DEGREES(ATAN(((E428/2)-(E427/2))/E429)) -> 25.327371945407155
A435: Ângulo de Hélice | B435: BETA | C435: º | D435: =DEGREES(ATAN((D424/2)/D425)) -> 12.499567711938433 | E435: =DEGREES(ATAN((E424/2)/E425)) -> 17.300527191945005
A436: Módulo Transversal | B436: mt | C436: mm | D436: =D424/PI() -> 2.928450952890874 | E436: =E424/PI() -> 3.0239439187460113
A437: Módulo Normal | B437: mn | C437: mm | D437: =D436*(COS(RADIANS(D440))) -> 2.8286664064181268 | E437: =E436*(COS(RADIANS(D440))) -> 2.9209055283665442
A438: Valores Adotados
A439: Ângulo de Pressão | B439: ALFA | C439: º | D439: 20
A440: Ângulo de Hélice | B440: BETA | C440: º | D440: 15
A441: Módulo (Normalizado) | B441: m | C441: mm | D441: 3
A442: Coeficiente de Deslocamento | B442: x | C442: - | D442: =Geral!$D$13 -> 0 | E442: =Geral!$E$13 -> 0
A443: Rendimento de Rolamento | B443: ETA r | C443: % | D443: =Geral!$D$3 -> 99
A444: Rendimento do Par Engrenado | B444: ETA e | C444: % | D444: =Geral!$D$4 -> 98
A445: Coeficiente de Segurança | B445: Kf | C445: - | D445: =Geral!$D$5 -> 1.5
A446: Valores Adicionais
A447: Potência de Entrada | B447: Pe | C447: W | D447: =$D$406 -> 94.128803999999988
A448: Rotação de Entrada | B448: ne | C448: RPM | D448: =$D$407 -> 128.76660341555976
A449: Fator de Forma do Dente | B449: Yf | C449: - | D449: =Geral!$D$14 -> 3.25 | E449: =Geral!$E$14 -> 2.75
A450: Fator de Serviço | B450: Ys | C450: - | D450: =Geral!$D$15 -> 1.25
A451: Precisão do Dente | B451: a* | C451: - | D451: =Geral!$D$16 -> 6
A452: Módulo de Elasticidade Equivalente | B452: Ec | C452: MPa | D452: =Geral!$D$6 -> 210000
A453: Valores Calculados
A454: Relação de Transmissão | B454: i | C454: - | D454: =IF((E423/D423),(E423/D423),(E430/D430)) -> 1.411764705882353
A455: Módulo Normal | B455: mn | C455: mm | D455: =D441 -> 3
A456: Módulo Transversal | B456: mt | C456: mm | D456: =D455/(COS(RADIANS(D440))) -> 3.1058285412302489
A457: Diâmetro Primitivo | B457: d | C457: mm | D457: =D423*D456 -> 52.799085200914234 | E457: =E423*D456 -> 74.539884989525973
A458: Distância entre eixos | B458: a | C458: mm | D458: =(D457+E457)/2 -> 63.669485095220104
A459: Número Virtual de Dentes | B459: Zv | C459: - | D459: =D423/(COS(RADIANS(D440)))^3 -> 18.863296320916014 | E459: =E423/(COS(RADIANS(D440)))^3 -> 26.630535982469663
A460: Ângulo de Pressão Normal | B460: ALFA n | C460: º | D460: =D439 -> 20
A461: Ângulo de Pressão Aparente | B461: ALFA t | C461: º | D461: =DEGREES(ATAN((TAN(RADIANS(D460))/COS(RADIANS(D440))))) -> 20.646896487046469
A462: Ângulo P.Normal na Cabeça | B462: ALFA a | C462: º | D462: =DEGREES(ACOS(D473/D475)) -> 32.829995444836591 | E462: =DEGREES(ACOS(E473/E475)) -> 29.996166455218869
A463: Ângulo de Hélice na Base | B463: BETA b | C463: º | D463: =DEGREES(ASIN((SIN(RADIANS(D440))*(COS(RADIANS(D460)))))) -> 14.076095421662487
A464: Evolvente de ALFA a | B464: ev ALFA a | C464: - | D464: =TAN(RADIANS(D462))-RADIANS(D462) -> 7.2205708287767068E-2 | E464: =TAN(RADIANS(E462))-RADIANS(E462) -> 5.3729194377724165E-2
A465: Evolvente de ALFA t | B465: ev ALFA t | C465: - | D465: =TAN(RADIANS(D461))-RADIANS(D461) -> 1.6453389896665449E-2
A466: Passo Axial | B466: px | C466: mm | D466: =PI()*D455/(SIN(RADIANS(D440))) -> 36.414545757388652
A467: Passo Normal | B467: pn | C467: mm | D467: =PI()*D455 -> 9.4247779607693793
A468: Passo Normal de Base | B468: pbn | C468: mm | D468: =PI()*D455*(COS(RADIANS(D460))) -> 8.8563943022806484
A469: Passo Frontal de Base | B469: pbt | C469: mm | D469: =PI()*D456*(COS(RADIANS(D460))) -> 9.1688140654707304
A470: Grau de Recobrimento Transversal | B470: E ALFA | C470: - | D470: =(1/(2*PI()))*((D423*(TAN(RADIANS(D462))-TAN(RADIANS(D461))))+(E423*(TAN(RADIANS(E462))-TAN(RADIANS(D461))))) -> 1.4918261258994254
A471: Grau de Recobrimento Normal | B471: E BETA | C471: - | D471: =(D425*SIN(RADIANS(D440)))/(PI()*D455) -> 0.56982723712240035
A472: Grau de Recobrimento Total | B472: E | C472: - | D472: =D470+D471 -> 2.0616533630218257
A473: Diâmetro da Base | B473: db | C473: mm | D473: =D457*COS(RADIANS(D461)) -> 49.407865455547594 | E473: =E457*COS(RADIANS(D461)) -> 69.752280643126014
A474: Diâmetro do Pé | B474: df | C474: mm | D474: =D457-(2*D455*(1+0.25-D442)) -> 45.299085200914234 | E474: =E457-(2*D455*(1+0.25-E442)) -> 67.039884989525973
A475: Diâmetro da Cabeça | B475: da | C475: mm | D475: =(2*D458)-E474-(2*0.25*D455) -> 58.799085200914234 | E475: =(2*D458)-D474-(2*0.25*D455) -> 80.539884989525973
A476: Espessura Normal | B476: Sn | C476: mm | D476: =D455*((PI()/2)+(2*D442*TAN(RADIANS(D460)))) -> 4.7123889803846897 | E476: =D455*((PI()/2)+(2*E442*TAN(RADIANS(D460)))) -> 4.7123889803846897
A477: Espessura Transversal | B477: St | C477: mm | D477: =D456*((PI()/2)+(2*D442*TAN(RADIANS(D460)))) -> 4.8786240642192267 | E477: =D456*((PI()/2)+(2*E442*TAN(RADIANS(D460)))) -> 4.8786240642192267
A478: Espessura Normal na Base | B478: Sbn | C478: mm | D478: =((D476/(D455*D423))+D465)*D455*D423*COS(RADIANS(D460)) -> 5.2167147338536308 | E478: =((E476/(D455*E423))+D465)*D455*E423*COS(RADIANS(D460)) -> 5.5413984443826401
A479: Espessura Transversal no Topo | B479: Sat | C479: mm | D479: =D475*((D476/(D457*COS(RADIANS(D440))))+D465-D464) -> 2.1548374485670152 | E479: =E475*((E476/(E457*COS(RADIANS(D440))))+D465-E464) -> 2.2691341401214249
A480: Altura do Dente | B480: h | C480: mm | D480: =0.5*(D475-D474) -> 6.75 | E480: =0.5*(E475-E474) -> 6.75
A481: Altura Útil Comum | B481: h' | C481: mm | D481: =(0.5*(D475+E475))-D458 -> 5.9999999999999929
A482: Altura da Cabeça (addendum) | B482: há | C482: mm | D482: =(D475-D457)/2 -> 3 | E482: =(E475-E457)/2 -> 3
A483: Altura do Pé (dedendum) | B483: hf | C483: mm | D483: =(D457-D474)/2 -> 3.75 | E483: =(E457-E474)/2 -> 3.75
A484: Velocidade Angular | B484: w | C484: rad / s | D484: =2*PI()*(D448/60) -> 13.484407177267764 | E484: =2*PI()*((D448/60)/D454) -> 9.5514550838979986
A485: Velocidade Tangencial | B485: v | C485: m / s^2 | D485: =PI()*D457*(D448/60000) -> 0.35598218171819007
A486: Potência de Saída | B486: Ps | C486: W | D486: =D447*(D443/100)*(D444/100) -> 91.323765640799976
A487: Rotação de Saída | B487: ns | C487: RPM | D487: =D448/D454 -> 91.209677419354819
A488: Momento Torsor | B488: Mt | C488: N x mm | D488: =D447/(D484*0.001) -> 6980.5667214413306 | E488: =D447/(E484*0.001) -> 9854.9177243877621
A489: Força Tangencial | B489: Ft | C489: N | D489: =D447/D485 -> 264.4199873872231 | E489: =D489*(D444/100) -> 259.13158763947865
A490: Força Axial | B490: Fa | C490: N | D490: =D489*TAN(RADIANS(D440)) -> 70.851122083054079 | E490: =D490*(D444/100) -> 69.43409964139299
A491: Força Radial | B491: Fr | C491: N | D491: =(D489*TAN(RADIANS(D460))/COS(RADIANS(D440))) -> 99.636019800543409 | E491: =D491*(D444/100) -> 97.643299404532542
A492: Fator de Engrenamento | B492: YE | C492: - | D492: =0.25+(0.75/D470) -> 0.75273955320887231
A493: Fator de Carga | B493: YV | C493: - | D493: =(D451+SQRT(D485))/D451 -> 1.0994404039443546
A494: Fator de Ângulo de Hélice | B494: YBETA | C494: - | D494: =1-(D440/120) -> 0.875
A495: Fator YBETA-H | B495: YBETA-H | C495: - | D495: =IF(D471>1,0.8,1) -> 1
A496: Flexão no Pé do Dente | B496: Fadm | C496: MPa | D496: =((D489/(D425*D455))*D449*D492*D450*D493*D494)*D445 -> 18.744076171274308 | E496: =((E489/(E425*D455))*E449*D492*D450*D493*D494)*D445 -> 21.148896233904132
A497: Desgaste no Flanco do Dente | B497: Hadm | C497: MPa | D497: =SQRT(((0.7*D452*D489*(COS(RADIANS(D440))^2)*(1+(1/D454)))/(D425*D457*SIN(RADIANS(2*D461))))*D450*D493*D495) -> 343.16956168915215 | E497: =SQRT(((0.7*D452*E489*(COS(RADIANS(D440))^2)*(1+(1/D454)))/(E425*E457*SIN(RADIANS(2*D461))))*D450*D493*D495) -> 333.51453545237388

A1: © Projeto ECM 2000 - Proibida a reprodução. | D1: Voltar ao Início desta Página