C1: Principal | Créditos
A3: Projeto | Componentes | Cálculos | Protótipo | Arquivos | Simulações
A4: Apresentação dos Cálculos - Eixos Entalhados

A1: Demonstrativos
A2: Geral
A3: Engrenagem Helicoidal
A4: Eixo Entalhado
A5: Parafusos
A6: Tabelas
A7: Geral
A8: Engrenagem Helicoidal
A9: Engrenagem Cônica
A10: Engrenagem Curva
A11: Eixo Entalhado
A12: Epicicloidal
A13: Parafusos
A14: Eixos

A1: Entalhe - Eixo Entrada
A2: Dimensão | B2: Letra | C2: Unidade | D2: Valor
A3: Valores Medidos para Cálculo
A4: Número de Entalhes | B4: Z | C4: - | D4: 14
A5: Diâmetro Interno | B5: d1 | C5: mm | D5: 21.3
A6: Diâmetro Externo | B6: d2 | C6: mm | D6: 24.25
A7: Comprimento do Entalhe | B7: L | C7: mm | D7: 48
A8: Valores Adotados
A9: Tensão Admissível | B9: P adm | C9: N/mm² | D9: =Geral!$D$19 -> 35
A10: Valores Calculados
A11: Raio Médio | B11: r | C11: mm | D11: =(D5+D6)/4 -> 11.387499999999999
A12: Altura do Entalhe | B12: h | C12: mm | D12: =(D6-D5)/2 -> 1.4750000000000001
A13: Força de Esmagamento | B13: Fesm | C13: N | D13: =D9*D12*D7 -> 2478
A14: Momento Torsor Máximo | B14: Mt | C14: N*mm | D14: =0.75*D4*D11*D13 -> 296291.36249999987
A16: Entalhe - Eixo Principal com Sincronizador
A17: Dimensão | B17: Letra | C17: Unidade | D17: Valor
A18: Valores Medidos para Cálculo
A19: Número de Entalhes | B19: Z | C19: - | D19: 34
A20: Diâmetro Interno | B20: d1 | C20: mm | D20: 35
A21: Diâmetro Externo | B21: d2 | C21: mm | D21: 37
A22: Comprimento do Entalhe | B22: L | C22: mm | D22: 15
A23: Valores Adotados
A24: Tensão Admissível | B24: P adm | C24: N/mm² | D24: =Geral!$D$19 -> 35
A25: Valores Calculados
A26: Raio Médio | B26: r | C26: mm | D26: =(D20+D21)/4 -> 18
A27: Altura do Entalhe | B27: h | C27: mm | D27: =(D21-D20)/2 -> 1
A28: Força de Esmagamento | B28: Fesm | C28: N | D28: =D24*D27*D22 -> 525
A29: Momento Torsor Máximo | B29: Mt | C29: N*mm | D29: =0.75*D19*D26*D28 -> 240975
A31: Entalhe - Eixo Principal com Engrenagem Ré-C
A32: Dimensão | B32: Letra | C32: Unidade | D32: Valor
A33: Valores Medidos para Cálculo
A34: Número de Entalhes | B34: Z | C34: - | D34: 27
A35: Diâmetro Interno | B35: d1 | C35: mm | D35: 27.7
A36: Diâmetro Externo | B36: d2 | C36: mm | D36: 29.5
A37: Comprimento do Entalhe | B37: L | C37: mm | D37: 30.35
A38: Valores Adotados
A39: Tensão Admissível | B39: P adm | C39: N/mm² | D39: =Geral!$D$19 -> 35
A40: Valores Calculados
A41: Raio Médio | B41: r | C41: mm | D41: =(D35+D36)/4 -> 14.3
A42: Altura do Entalhe | B42: h | C42: mm | D42: =(D36-D35)/2 -> 00.9
A43: Força de Esmagamento | B43: Fesm | C43: N | D43: =D39*D42*D37 -> 956.02499999999998
A44: Momento Torsor Máximo | B44: Mt | C44: N*mm | D44: =0.75*D34*D41*D43 -> 276840.93937500013
A46: Entalhe - Eixo Principal com Eixo Cardan
A47: Dimensão | B47: Letra | C47: Unidade | D47: Valor
A48: Valores Medidos para Cálculo
A49: Número de Entalhes | B49: Z | C49: - | D49: 23
A50: Diâmetro Interno | B50: d1 | C50: mm | D50: 23
A51: Diâmetro Externo | B51: d2 | C51: mm | D51: 24.95
A52: Comprimento do Entalhe | B52: L | C52: mm | D52: 104
A53: Valores Adotados
A54: Tensão Admissível | B54: P adm | C54: N/mm² | D54: =Geral!$D$19 -> 35
A55: Valores Calculados
A56: Raio Médio | B56: r | C56: mm | D56: =(D50+D51)/4 -> 11.987500000000001
A57: Altura do Entalhe | B57: h | C57: mm | D57: =(D51-D50)/2 -> 0.97499999999999998
A58: Força de Esmagamento | B58: Fesm | C58: N | D58: =D54*D57*D52 -> 3549
A59: Momento Torsor Máximo | B59: Mt | C59: N*mm | D59: =0.75*D49*D56*D58 -> 733877.74687499972
A61: Entalhe - Eixo Primário com Engrenagem Ré-A
A62: Dimensão | B62: Letra | C62: Unidade | D62: Valor
A63: Valores Medidos para Cálculo
A64: Número de Entalhes | B64: Z | C64: - | D64: 23
A65: Diâmetro Interno | B65: d1 | C65: mm | D65: 24
A66: Diâmetro Externo | B66: d2 | C66: mm | D66: 25.7
A67: Comprimento do Entalhe | B67: L | C67: mm | D67: 28.45
A68: Valores Adotados
A69: Tensão Admissível | B69: P adm | C69: N/mm² | D69: =Geral!$D$19 -> 35
A70: Valores Calculados
A71: Raio Médio | B71: r | C71: mm | D71: =(D65+D66)/4 -> 12.425000000000001
A72: Altura do Entalhe | B72: h | C72: mm | D72: =(D66-D65)/2 -> 00.85
A73: Força de Esmagamento | B73: Fesm | C73: N | D73: =D69*D72*D67 -> 846.38750000000005
A74: Momento Torsor Máximo | B74: Mt | C74: N*mm | D74: =0.75*D64*D71*D73 -> 181407.29085937492
A76: Entalhe - Sincronizador com Anel do Garfo
A77: Dimensão | B77: Letra | C77: Unidade | D77: Valor
A78: Valores Medidos para Cálculo
A79: Número de Entalhes | B79: Z | C79: - | D79: 30
A80: Diâmetro Interno | B80: d1 | C80: mm | D80: 62
A81: Diâmetro Externo | B81: d2 | C81: mm | D81: 66.25
A82: Comprimento do Entalhe | B82: L | C82: mm | D82: 26.25
A83: Valores Adotados
A84: Tensão Admissível | B84: P adm | C84: N/mm² | D84: =Geral!$D$19 -> 35
A85: Valores Calculados
A86: Raio Médio | B86: r | C86: mm | D86: =(D80+D81)/4 -> 32.0625
A87: Altura do Entalhe | B87: h | C87: mm | D87: =(D81-D80)/2 -> 2.125
A88: Força de Esmagamento | B88: Fesm | C88: N | D88: =D84*D87*D82 -> 1952.34375
A89: Momento Torsor Máximo | B89: Mt | C89: N*mm | D89: =0.75*D79*D86*D88 -> 1408432.9833984375
A91: Entalhe (ext.) - Luva do Diferencial com Eixo Cardan
A92: Dimensão | B92: Letra | C92: Unidade | D92: Valor
A93: Valores Medidos para Cálculo
A94: Número de Entalhes | B94: Z | C94: - | D94: 22
A95: Diâmetro Interno | B95: d1 | C95: mm | D95: 32.5
A96: Diâmetro Externo | B96: d2 | C96: mm | D96: 37.3
A97: Comprimento do Entalhe | B97: L | C97: mm | D97: 17.4
A98: Valores Adotados
A99: Tensão Admissível | B99: P adm | C99: N/mm² | D99: =Geral!$D$19 -> 35
A100: Valores Calculados
A101: Raio Médio | B101: r | C101: mm | D101: =(D95+D96)/4 -> 17.45
A102: Altura do Entalhe | B102: h | C102: mm | D102: =(D96-D95)/2 -> 2.4
A103: Força de Esmagamento | B103: Fesm | C103: N | D103: =D99*D102*D97 -> 1461.6
A104: Momento Torsor Máximo | B104: Mt | C104: N*mm | D104: =0.75*D94*D101*D103 -> 420831.18
A106: Entalhe (int.) - Luva do Diferencial com Eixo de Entrada
A107: Dimensão | B107: Letra | C107: Unidade | D107: Valor
A108: Valores Medidos para Cálculo
A109: Número de Entalhes | B109: Z | C109: - | D109: 20
A110: Diâmetro Interno | B110: d1 | C110: mm | D110: 20.2
A111: Diâmetro Externo | B111: d2 | C111: mm | D111: 21.7
A112: Comprimento do Entalhe | B112: L | C112: mm | D112: 33.5
A113: Valores Adotados
A114: Tensão Admissível | B114: P adm | C114: N/mm² | D114: =Geral!$D$19 -> 35
A115: Valores Calculados
A116: Raio Médio | B116: r | C116: mm | D116: =(D110+D111)/4 -> 10.475
A117: Altura do Entalhe | B117: h | C117: mm | D117: =(D111-D110)/2 -> 0.75
A118: Força de Esmagamento | B118: Fesm | C118: N | D118: =D114*D117*D112 -> 879.375
A119: Momento Torsor Máximo | B119: Mt | C119: N*mm | D119: =0.75*D109*D116*D118 -> 138171.796875
A121: Entalhe - Eng.Cônica G com Eixo da Roda
A122: Dimensão | B122: Letra | C122: Unidade | D122: Valor
A123: Valores Medidos para Cálculo
A124: Número de Entalhes | B124: Z | C124: - | D124: 24
A125: Diâmetro Interno | B125: d1 | C125: mm | D125: 24.45
A126: Diâmetro Externo | B126: d2 | C126: mm | D126: 26.1
A127: Comprimento do Entalhe | B127: L | C127: mm | D127: 30
A128: Valores Adotados
A129: Tensão Admissível | B129: P adm | C129: N/mm² | D129: =Geral!$D$19 -> 35
A130: Valores Calculados
A131: Raio Médio | B131: r | C131: mm | D131: =(D125+D126)/4 -> 12.637499999999999
A132: Altura do Entalhe | B132: h | C132: mm | D132: =(D126-D125)/2 -> 0.82500000000000107
A133: Força de Esmagamento | B133: Fesm | C133: N | D133: =D129*D132*D127 -> 866.25000000000102
A134: Momento Torsor Máximo | B134: Mt | C134: N*mm | D134: =0.75*D124*D131*D133 -> 197050.21875000023

A1: © Projeto ECM 2000 - Proibida a reprodução. | D1: Voltar ao Início desta Página